Key,EN,ZH
TROUPE_LEADER_ALLRESCUED,"&lt;hpage&gt;That is well, Fleamaster. My travels through this land have been far and deep, and yet at almost every reach I met the friendly, inquisitive presence of your kind.&lt;hpage&gt;You fleas have an uncommon desire for adventure which I find admirable, even if it is seldom matched by capability.&lt;hpage&gt;Though I am long accustomed to travelling alone, following your journey, and sharing some part in its progress has been a warm thing.&lt;page&gt;Ahh, and so happy too have you made we fleas!&lt;page&gt;I would be honoured to bestow one final gift unto you, miss Hornet, a treasure from fleakind&#8217;s glorious past. May it mark you forever as a friend to us all.",&lt;hpage&gt;那就好，跳蚤首领。我走遍这片土地，几乎每个地方都能遇见你们好奇的同胞。&lt;hpage&gt;你们跳蚤对冒险的渴望让我钦佩，虽然能力未必都能跟上。&lt;hpage&gt;我习惯独行，但能见证你们的旅途、参与其中让我很温暖。&lt;page&gt;哈哈，你让我们跳蚤也很开心！&lt;page&gt;请允许我献上最后的赠礼，大黄蜂小姐，这是跳蚤一族昔日的珍宝。愿它永远守护你，见证你是我们的朋友。
CARAVAN_LECH_SPA_ACCEPT_INTIMIDATED,"The spa is yours, dear guest! And always open for one so considerate and kindly as yourself... eheh heh...",温泉随时为你开放，亲爱的客人！像你这样贴心善良的客人永远欢迎……嘿嘿嘿……
CARAVAN_LECH_SAVED_REPEAT,"With luck, my dear, we will meet again when I have joined the flea caravan.&lt;page&gt;My carriage hides a special secret I&#8217;d gladly to share with you when next we meet!",运气好的话，我们会在跳蚤旅团再见。&lt;page&gt;我的车厢里有个特别的惊喜，下次见面一定告诉你！
TROUPE_LEADER_GAMES_INTRO_ACCEPT_1,"The pact is made then. Fellows! Steel yourself! It is time, it is time!",契约达成！伙计们！打起精神！时候到了，时候到了！
TROUPE_MEMBER_TALL_FLEATOPIA_REPEAT,This long lake... Space is much more big here. Finally I have some quiet from the little fleas.,这片长湖……地方大多了。终于能躲开小跳蚤们清净会儿了。
TROUPE_LEADER_QUEST1_TRAVEL_DECLINE,"Ahh, that is a shame, but I understand. I&#8217;m sure our roads will cross each other soon enough.&lt;page&gt;And now, we must be off! Rouse yourself, fleas. The caravan roams once more!",唉，虽然遗憾，但我理解。相信我们很快会再相遇。&lt;page&gt;现在，我们该出发了！跳蚤们动起来，旅团要再度启程啦！
FG_JUGGLE_INTRO_GAMESCOMPLETE,"The grand ceremony has ended, but still we play! Will you honour us with a display of Flea Juggle, Miss Grand Champion Hornet?",盛大的仪式已经结束，但我们还要继续玩！总冠军大黄蜂小姐，愿意再来一场跳蚤耍耍吗？
TROUPE_LEADER_GREYMOOR_TRAVEL,Wonderful! Wonderful! The fleas will be overjoyed to share this next journey with our favoured companion! Let us away!,太好了！跳蚤们肯定会因为有贵客同行而欢欣雀跃！我们这就出发！
FG_BOUNCE_ACCEPT,Mamashka! Let our beautiful game begin! Flea Bounce!,玛玛什卡！美丽的游戏开始了！跳蚤蹦蹦！
TROUPE_LEADER_JUDGE_READYTOLEAVE_NO_LAKE,"&lt;hpage&gt;Unfortunately not, Fleamaster. I have visited many of this kingdom&#8217;s caves and none would offer the safety and space you require.&lt;hpage&gt;If ever I come upon such a place, I will let you know.",&lt;hpage&gt;很遗憾，没有，跳蚤首领。我去过的洞窟都不符合你们的需求。&lt;hpage&gt;但如果将来遇到，肯定会来告诉你们。
FESTIVAL_BOARD_SPIRIT_NAME,Flealia,芙罗拉
FG_JUGGLE_INTRO_FIRST,"How do you like our festival, Miss Hornet? While the world crumbles around us, we will laugh and dance and frolick!&lt;page&gt;Make merry with us, and play some of the games of old!&lt;hpage&gt;My time is slim, Fleamaster. If I am to join your games, know it will be only to hone my skills for the greater trial I must soon face below.&lt;page&gt;Of course! Of course! Joy or learnings! Any reason is fine by us, Miss Hornet!&lt;page&gt;And look here, we have Flea Juggle, where the challenge is to strike fleas upwards and keep them airborne for as long as possible.&lt;page&gt;To have our treasured guest challenge this humble game would be an honour for us, truly!",大黄蜂小姐觉得我们的庆典如何？就算世界崩塌，我们也要欢笑起舞！&lt;page&gt;开心点，来陪我们玩玩老游戏吧！&lt;hpage&gt;我时间紧迫，跳蚤首领。参加游戏只是为了磨练技艺，应对即将到来的大考。&lt;page&gt;都行都行！不管是玩乐还是修行都可以！&lt;page&gt;看这里，这是跳蚤耍耍——把跳蚤打上天，滞空越久越好！&lt;page&gt;贵客肯赏脸挑战，我们荣幸之至！
CARAVAN_LECH_WOUNDED_REPEAT,"A mistake, treasured guest! Never again! Ohhh. Never again!",一场误会啊贵客！绝不再犯！我保证！
TROUPE_HUNTER_MEET,"&lt;hpage&gt;Fair greetings again, large flea. Amongst all of your troupe, I had little doubt you would survive to reach this caravan.&lt;hpage&gt;Would you tell me now of the task that saw you so apart from your fellows, and so fearsome in form?&lt;page&gt;Grrr....Bug not flea! Mine is to track, by trail and smell and senses sharp. Find our friend fleas, our young most of most, to bring them together and grow them strong.&lt;hpage&gt;If you have sensed the locations of other lost fleas, share them with me. I may be able to send them safe to the caravan.&lt;page&gt;My learnings? Not free for you, bug not flea. Rosaries! Give those and I shall say of what I have sensed. Work like mine... much long, and hard. For that, I deserve some riches held.",&lt;hpage&gt;又见面了，大个子。在你们旅团里，我就知道你肯定能活着找到这里。&lt;hpage&gt;能告诉我你为何离群索居，还练就这副体魄么？&lt;page&gt;吼……虫子，不是跳蚤！我是靠踪迹和气味追踪，找回我们的跳蚤同伴，尤其是幼崽，让族群壮大。&lt;hpage&gt;如果你知道其他失落跳蚤的位置，告诉我。我也许能让他们安全归队。&lt;page&gt;我的情报？虫子，不是跳蚤，不白给。念珠！给我念珠我就告诉你。我的工作又苦又累，理应拿点报酬。
TROUPE_LEADER_REPEAT_FLEATOPIA_ACT3,"So many lost fleas have made it here... Truly, I&#8217;d never dared to hope we could gather such a grand company.&lt;page&gt;But, oh! The world has grown so dangerous, and there may be more lost fleas out there. I do so hope they can find their way to us!",这么多失落的跳蚤都到了这里……我从没敢想能聚集起这么大的队伍。&lt;page&gt;不过，外面世界更危险了，也许还有更多失落者。真希望他们能找到我们！
TROUPE_LEADER_REPEAT_FLEATOPIA_ALLRESCUED_ACT3,"We fleas are all gathered, but now the world has loudly marked its ending! As great as our numbers grew, it seems our caravan will be the last.&lt;page&gt;There is only one thing left to do... but the preparations require time. If your travels wind their way back to us, dear friend, you yourself are welcome to participate...",跳蚤们虽已团聚，但世界即将毁灭！恐怕我们是最后的旅团了……&lt;page&gt;只剩最后一事可做……但需时间准备。亲爱的朋友，如果再来，欢迎参与……
TROUPE_LEADER_FLEATOPIA_HUNTER_HINT,"Miss Hornet, I must tell, we&#8217;ve seen evidence nearby of a hunter of our tribe, a flea that seeks fleas!&lt;page&gt;As pungent and gruff as their sort often are, they&#8217;re still useful to have around a caravan.&lt;page&gt;A flea of their rare skill, settled among us, could offer defence and more.&lt;page&gt;If you&#8217;re still to be helping grow our town, search them out, up atop the muck choked ducts.",大黄蜂小姐！我们发现附近有跳蚤猎手的踪迹，那是专门追踪跳蚤的跳蚤！&lt;page&gt;虽然那家伙气味浓烈又粗鲁，但对旅团很有用。&lt;page&gt;这样的高手要是能加入，不仅能护卫大家，还有大用。&lt;page&gt;如果你还愿意帮忙壮大旅团，就去腐殖渠上面找找吧！
FESTIVAL_POT_INSPECT,A cauldron full of Flea Brew.,一大锅跳蚤药酿。
TROUPLE_HUNTER_MEET_COMPLETE,"&lt;hpage&gt;Fair greetings again, large flea. Of your many companions, I had little worry you would survive safe to find this caravan.&lt;hpage&gt;Would you tell me now of the task that saw you so apart from your fellows, and so fearsome in form?&lt;page&gt;Grrr....Mine was to track, by trail and smell and senses sharp. Find our friend fleas, our young most of most, to bring them together so strong they could grow.&lt;page&gt;A task once important, mine! But not now. All fleas are here, safe. A rare many! Time for toasts, and brew to fill our bellies!",&lt;hpage&gt;又见面了，大个子。你能活着找到旅团我一点都不担心。&lt;hpage&gt;能告诉我你为何离群索居，还练就这副体魄么？&lt;page&gt;吼……我以前负责追踪，靠着足迹气味，找回幼崽养壮族群。&lt;page&gt;这差事曾经很重要，但现在没必要了！所有跳蚤都在这里，安全无恙！该喝酒庆祝了！
TROUPE_LEADER_GREYMOOR_CANLEAVE,"Look here! All these lively fleas flocked to our caravan. Thanks to you and your hunting, our numbers grow grand. Mayhap, in time, we could grow to match even those caravans of our fabled past?&lt;hpage&gt;To see so many safe is a welcome sight, Fleamaster. Their playful cheer suggests you are a fine steward for the swelling troupe.&lt;page&gt;Such kind words, Miss Hornet! How lucky we are to have found a friend so fair!&lt;page&gt;But now, we must away! These moors have been our host long enough. It is time to climb and hoist towards drier caves!&lt;page&gt;Good friend to fleas, would you join us on this next journey?",看！这么多活蹦乱跳的跳蚤加入了旅团。多亏你的帮助，队伍越来越壮大。也许有朝一日能重现传说中的盛况？&lt;hpage&gt;看到这么多跳蚤平安无事真让人欣慰。他们的欢声笑语也说明你是个好领队。&lt;page&gt;大黄蜂小姐过奖了！能结交你这样的朋友才是旅团的幸运！&lt;page&gt;但现在该启程了！沼地虽好，但不应久留，该向更干燥的洞窟进发了！&lt;page&gt;跳蚤之友，愿意与我们一起出发吗？
FG_DODGE_COMPLETED_CHAMP,"Vikna. The trial has ended.&lt;page&gt;Bug not flea... impressive was your performance. Your score exceeds even my own.&lt;page&gt;To see skill so much, moments before everything ends, gives me unexpected joy.&lt;page&gt;Rishkiz... I congratulate you, champion.",维克纳，试炼结束。&lt;page&gt;虫子，不是跳蚤……你的表现很厉害，分数甚至超过了我。&lt;page&gt;末日前还能见到这样的技艺，真是意外的惊喜。&lt;page&gt;里什基兹……祝贺你，冠军。
FESTIVAL_BOARD_TITLE_DODGE,Dodge,跳蚤溜溜
TROUPE_LEADER_GREYMOOR_MEET,"Ahh, Miss Hornet! Greetings, and well met, once again!&lt;page&gt;The journey here was long, but we didn&#8217;t lose a single flea! And now fate has brought us back together again... what a marvel!&lt;hpage&gt;It is good to see you safe, Fleamaster. The journey to this moor from the caverns below is long and dangerous.&lt;page&gt;Dangerous, certainly, but we fleas are born to roam!&lt;page&gt;And now, you must go and see Grishkin, sitting there by the bubbling cauldron. After long travel, we drink to revive our spirits!",啊！大黄蜂小姐！又见面真是太好了！&lt;page&gt;这一路很长，但我们一只跳蚤都没丢！命运让我们重逢，真是奇迹！&lt;hpage&gt;旅团平安就好，从下方洞窟到这沼地，路上肯定充满危险。&lt;page&gt;确实很危险，但跳蚤天生爱流浪！&lt;page&gt;现在你该去找格里什琴了，她就在冒泡的大锅旁。长途跋涉后该喝点提神！
TROUPE_HUNTER_WILD_MEET,"Grrr.. bug not flea. Why you must bother me? This spot is mine, fair fought and earned.&lt;hpage&gt;I won&#8217;t stay long, madam. Nor would I contest your right to this cave.&lt;hpage&gt;I have encountered several of your fellows fleas, united in a caravan. Perhaps you would consider joining with them?&lt;hpage&gt;Yours seems a hardy hide, and I fear alone they lack the strength to survive long in this land.&lt;page&gt;Caravan? Grrr. Felt it in my fur... Time for change. If caravan is close, then my task, these lands, may near be complete.&lt;page&gt;Now... Grrr. Much talk I gave. You leave me! Meet again at caravan, amongst good fellows. There I share my learnings of fleas and Pharloom. Till then, rest I need! Off, bug!",吼……虫子，不是跳蚤。干嘛烦我？这地方是我打下来的！&lt;hpage&gt;我不会久留，女士，也不会和你争这山洞。&lt;hpage&gt;我遇到过你的同伴跳蚤，他们已经在旅团里团聚了。你要不要加入他们？&lt;hpage&gt;你看起来很强壮，我担心他们独自在这片土地上撑不久。&lt;page&gt;旅团？吼……我感觉到了……是时候了。如果旅团就在附近，我的任务和这片土地也快结束了。&lt;page&gt;现在……吼，话说得够多了。你走吧！旅团再见，到时我会告诉你跳蚤和纺络的情报。现在我要休息！快走，虫子！
TROUPE_LEADER_GAMES_INTRO_TALK_2,"Ohhhh! What other choice do we poor wretches have?! Cruel fate leaves us with only one last task...&lt;page&gt;Dear friend... Miss Hornet! Forgive us, but we beg one more favour from you. Will you accompany us in our final act...?",唉！我们这些可怜虫别无选择！残酷的命运只留下这一最后任务……&lt;page&gt;亲爱的朋友……大黄蜂小姐！请原谅，但我们还想再求你一个忙。愿意陪我们完成最后一幕吗……？
FG_JUGGLE_COMPLETED_CHAMP,"Vikna! The game is ended, and we have a new Flea Juggle champion! Incredible!&lt;page&gt;Miss Hornet, with your skill I&#8217;m certain you could best all three of our games and become the grandest champion of them all!",维克纳！游戏结束！新的跳蚤耍耍冠军诞生了！太强了！&lt;page&gt;大黄蜂小姐，以你的本事绝对能包揽我们三种游戏的冠军！
CARAVAN_LECH_SAVED_ACT3,"My, what a sweet face now emerges from the darkness! Poor Kratt has been hiding here from those blackened beasts for too long, all alone!&lt;hpage&gt;The beasts and bugs ensnared by the black thread are dangerous indeed. You have done right to hide yourself from them, sir.&lt;hpage&gt;That metal carriage... It is yours, I assume?&lt;page&gt;Ooh, yes, yes! I&#8217;m setting out to join the nearest flea caravan, aren&#8217;t I? Safety in numbers, yes? I&#8217;ve had more than enough of venturing alone.&lt;page&gt;And you... I trust I will see you there? My carriage hides a special secret I&#8217;d gladly share with you when next we meet! Heh heh!",哇，黑暗中竟出现这样美丽的脸！可怜的克拉特独自在这躲避黑丝太久了。&lt;hpage&gt;被黑丝缠住的虫兽确实危险，你躲起来是对的。&lt;hpage&gt;那金属车厢……是你的吧？&lt;page&gt;对对！我正要去最近的跳蚤旅团，抱团才安全！我已经受够独自冒险了。&lt;page&gt;你……也会去吧？下次见面我会在车厢里给你准备个惊喜！嘿嘿！
TROUPE_LEADER_COMPLETE_QUEST1,"There are still many fleas for us to be united with though, and we&#8217;ve rested long enough. The caravan must head higher!&lt;page&gt;Oh but stranger, how remiss of me! I introduced myself earlier without ever asking for your own name. Forgive me! Please, what shall we call you?&lt;hpage&gt;You may call me Hornet, Fleamaster. Know that I, like you, am glad to see your fellow fleas safe with your caravan. These are dangerous lands to travel alone.&lt;hpage&gt;I still have a long journey ahead of me. If I come across any more fleas, I will assist where I am able.&lt;page&gt;Oh, vavenda! That is to say, incredible! What a beautiful thing for me to hear!&lt;page&gt;Dear friend... Miss Hornet. Our caravan must be away now, toward the wide moor high above. Would you travel with us, as our honoured guest?",虽然还有许多跳蚤未归，但我们休息太久了。旅团该向高处进发了！&lt;page&gt;噢外乡人，我太失礼了！请问该如何称呼你？&lt;hpage&gt;叫我大黄蜂，跳蚤首领。我也很高兴看到你的同胞安全归队，这片土地独行太危险了。&lt;hpage&gt;我的旅途还很长，如果再遇见跳蚤，会尽力帮忙。&lt;page&gt;噢，真不可思议！能听到这样的话太美好了！&lt;page&gt;亲爱的朋友……大黄蜂小姐。旅团现在要出发，前往上方辽阔沼地。愿意作为贵宾与我们同行吗？
TROUPE_MEMBER_TALL_FLEATOPIA,So many awful places have us fleas travelled. Many times I almost die. But here is seems safe enough.&lt;page&gt;You will have rest too? Is space enough for us all now... friend.,跳蚤们去过太多糟糕的地方，好几次我都差点死了。但这里似乎很安全。&lt;page&gt;你也留下休息吧，朋友？现在地方够大了。
TROUPE_LEADER_MEET_JUDGE,"Welcome again, Miss Hornet! See how high our caravan has climbed, resting right on the doorstep of that mighty Citadel!&lt;hpage&gt;It is fortunate that all of your companions survive the trek, Fleamaster. The howling rise beside, and the tangled wood before it, have both claimed the lives of countless bugs.&lt;page&gt;Indeed! A perilous ascent! We have seen the many husks in passing. A mighty luck must shine on us, to journey with such success.",欢迎你再次到来，大黄蜂小姐！看我们旅团爬得多高啊，就在圣堡门口！&lt;hpage&gt;你们能平安抵达这里实属幸运，旁边的峭壁和前面的丛林都葬送过无数虫子。&lt;page&gt;确实危险！路上见到了无数空壳。我们一定是命运眷顾。
TROUPE_LEADER_COMPLETE_QUEST1_INTRO,"Look, look! So many fleas have joined the caravan! What a miracle! We can not thank you enough for honouring our humble wish!",看呐！这么多跳蚤加入了旅团！真是奇迹！我们怎么感谢你实现愿望都不够！
TROUPE_HUNTER_MEET_ACT3,"You remain, bug not flea? Would you seek service of me, ehh? Mine is knowledge much, the places of the lost little ones, heard and smelt across the caves.&lt;page&gt;You help find! And bring! Best we come together, we fleas all... now that times turn dark...",你还在这里，虫子，不是跳蚤？想让我帮忙吗？我知道那些失落小家伙的位置，听闻和嗅到过遍布洞穴。&lt;page&gt;你帮忙找到！带他们来！大家最好团聚，现在黑暗降临……
FG_BOUNCE_DECLINE,"As you wish, sweet one. Shall we just rest here together on the shore of eternity instead?",如你所愿，甜心。要不就在这岸边一起静静地守望末日？
CARAVAN_LECH_SPA_PROMPT,Enter spa?,进入温泉？
FG_JUGGLE_ACCEPT,"Mamashka! I am saying, let the game begin! Flea Juggle!",玛玛什卡！我说，游戏开始！跳蚤耍耍！
TROUPE_LEADER_MEET_FLEATOPIA_TRAVELED,"What a beautiful spot you&#8217;ve gifted us, Miss Hornet! Safe apart from the dark and death of the lands beside. A place for fleas to grow smart and strong.&lt;page&gt;Here we shall see our travels end, for in Pharloom there could be no finer place to settle.&lt;hpage&gt;I am glad the location suits, Fleamaster. It is a calming thing to know these many fleas may survive. Most bugs of Pharloom seem destined for far bleaker fates.&lt;page&gt;Indeed! A hopeful future awaits! And only because of yourself and your efforts. To commemorate our arrival, it would be my pleasure to perform a small service for you.&lt;page&gt;I have been learning to sew, and the little fleas have been gathering materials for me. I thought I could add an extra pocket to your tool pouch, to make your travels just a little easier.&lt;page&gt;A trifling favour, much less than you deserve, but still I hope it meets to your satisfaction!",大黄蜂小姐选的地方太好了！远离黑暗和死亡，跳蚤们能在这里茁壮成长。&lt;page&gt;这里就是我们旅途的终点了，纺络再没有更好的归宿。&lt;hpage&gt;很高兴你们喜欢这里，跳蚤首领。能让这么多跳蚤幸存下来，真让人安心。纺络的大多数虫子都没这么幸运。&lt;page&gt;没错！未来充满希望，这都多亏了你。为纪念乔迁之喜，我想为你做点小事。&lt;page&gt;我最近在学缝纫，小跳蚤们帮我收集材料。我想给你的工具袋加个口袋，让旅途轻松些。&lt;page&gt;区区薄礼，不足挂齿，但希望你喜欢！
FG_BOUNCE_INTRO_CHAMP,"My dear Flea Bounce champion, will you play with us again? Let us dance and fly above the waters until the world itself falls away!",亲爱的跳蚤蹦蹦冠军，要再玩一次吗？在水面上飞舞直到世界终结吧！
CARAVAN_LECH_ACT3_MEET,Sweet one! What a delight to see you emerge from the horrible darkness now enveloping the world!&lt;page&gt;Poor Kratt feared he would have only his mangy fellow fleas for company at the end of everything. How kind of you to spend your last moments here with me!,甜心！没想到世界末日还能和你见面，真高兴！&lt;page&gt;可怜的克拉特本以为最后只能和脏跳蚤们作伴，多谢你在这最后时刻陪着我！
FESTIVAL_BOARD_HORNET_NAME,Hornet,大黄蜂
TROUPE_LEADER_ACCEPTED_WISHWALL_QUEST1_FULL,"&lt;hpage&gt;Fleamaster, I took your request from the wishwall in the pilgrim camp. You are seeking fleas to join your caravan? I have found and freed many throughout my travels.&lt;page&gt;Oh yes, indeed! And look here, they all have made their way to us! So many gathered, it seems a miracle. Our wishes granted before even your promise was known!",&lt;hpage&gt;跳蚤首领，我在朝圣营地的祈愿墙接下了你的请求。你在召集跳蚤加入旅团？我在旅途中已经救了很多跳蚤。&lt;page&gt;没错！看啊，他们全都来了！这么多人聚在一起，简直是奇迹。我们的愿望还没说出口就实现了！
FG_JUGGLE_COMPLETED,"Vikna! The game is now ended, but you can play again, as much you wish... until the end of the world comes for us all!",维克纳！游戏结束，但你随时可以重玩……直到世界末日！
TROUPE_LEADER_OFFER_QUEST1,"Stranger, will you hear my worry? The time has come for us fleas to find each other and travel together, as has happened through generations before.&lt;page&gt;The many fleas of this kingdom should be flocking to our caravan, but times have become dangerous. You feel it too, yes? Our poor cousins, out there, in hiding!&lt;page&gt;Would you, could you, help us find these poor, lost fleas? We daren&#8217;t continue our journey until some of the poor dears have found their way here to us!",外乡人，愿意听听我的烦恼吗？现在是跳蚤们团聚同行的时候了，就像过去的世代一样。&lt;page&gt;王国里的跳蚤本该都来投奔旅团，但现在太危险了。你也能感受到吧？可怜的同胞们还在外面躲藏！&lt;page&gt;你愿意帮忙寻找这些可怜的失落跳蚤吗？同胞没到齐我们不敢上路啊！
TROUPE_TRAVEL_PROMPT,Travel with the Flea Caravan?,与跳蚤旅团同行？
TROUPE_LEADER_GREYMOOR_LEAVE,"Alas, Miss Hornet! Until our paths cross again, our dearest wishes go with you.&lt;hpage&gt;Safe travels to you and your troupe, Fleamaster.",那好吧，大黄蜂小姐！愿好运常伴你左右，下次再见！&lt;hpage&gt;也祝你和你的旅团一路平安。
FESTIVAL_OUTRO_POST,"And so the great ceremony has reached its climax and its grand champion has emerged!&lt;page&gt;Thank you for spending your last moments with us here, Miss Hornet.&lt;page&gt;Though the world will soon end, and our paradise will crumble, the memories of friendship we all shared shall surely echo through the oncoming void for all eternity!&lt;hpage&gt;Fleamaster, your sentiment is kind, but this world will not end.&lt;page&gt;Oh? How good of you to speak words of hope for our benefit, but we have accepted our fate. Come, let us forget the past and revel together!&lt;hpage&gt;It is not merely hope that I offer you sir, but a promise. This kingdom&#8217;s suffering has a singular cause, and by my own claw will it be cleansed.&lt;hpage&gt;Perhaps not every flea will survive what is coming... but the world will not die, and your settlement may still see chance to prosper.&lt;page&gt;Ahh? You speak... with such conviction. But I cannot bring myself to hope such, I am sorry.&lt;page&gt;Come what may, we fleas will be here until the end. And the games will continue, of course! Celebrate with us for as long as you wish, dear friend.",加冕仪式结束，庆典高潮已过，总冠军诞生！&lt;page&gt;大黄蜂小姐，感谢你与我们共度最后时光。&lt;page&gt;即使世界即将终结，乐园即将崩塌，我们的友谊也会永远回响在虚空中！&lt;hpage&gt;跳蚤首领，你的心意很好，但这个世界不会终结。&lt;page&gt;哦？你愿意给我们希望，但我们已经认命了。来吧，让我们忘掉过去一起狂欢！&lt;hpage&gt;我给的不是虚无的希望，而是承诺。这个王国的苦难有根源，我会亲手终结它。&lt;hpage&gt;也许不是所有跳蚤都能幸存……但世界不会毁灭，你们的家园还有希望。&lt;page&gt;啊？你说得这么坚定。但我不敢奢望，对不起。&lt;page&gt;无论如何，我们跳蚤会坚持到最后。游戏永不停止！你想在这里玩多久都行，朋友！
