Key,EN,ZH
TROUPE_LEADER_DECLINE_QUEST1,"Ah... I understand, stranger. I presume too much of one who is not a flea.&lt;page&gt;I&#8217;ve heard the settlement below us is setting up a wishwall. Perhaps I&#8217;ll send Grishkin down to hang up our wish...&lt;page&gt;",啊……我明白，外乡人。对一个不是跳蚤的虫子要求太多了。&lt;page&gt;听说下面的定居点正在建祈愿墙，也许我会让格里什琴去挂上我们的愿望……&lt;page&gt;
TROUPE_HUNTER_EMPTY,"Bug not flea, my learnings, all have been scratched to your maps. Can give no more.&lt;page&gt;Leave now! Seek and save lost fleas, for a caravan full and whole!",虫子，不是跳蚤，我知道的都已经标在你的地图上了。没有更多可给你的了。&lt;page&gt;快走吧！去寻找并救助失落的跳蚤，让旅团团圆！
TROUPE_LEADER_INFO_HUNTER,"Have you met her yet? Our burly new companion, Vog! Fresh returned from a long time spent tracking.&lt;hpage&gt;We have met, Fleamaster. It gladdens me that so strong a flea exists as her.&lt;hpage&gt;Yours was a caravan sorely lacking for protection, and I am too bound by my own tasks to provide it for you.&lt;page&gt;Why, we would never impose so! And now, no matter! Her scent may be strong, and her taste for brew bottomless, but her skill is sharp.&lt;page&gt;If predators draw close, her talents will provide much confidence to our caravan.",你见过她了吗？我们新来的强壮同伴沃葛！她追踪本领高强，刚刚归队。&lt;hpage&gt;见过了，跳蚤首领。能有她这样强大的跳蚤真让我高兴。&lt;hpage&gt;你们旅团一直缺少护卫，而我又有自己的任务，无法保护你们。&lt;page&gt;怎么会让您为难呢！现在也没关系！她虽然气味浓烈，酒量惊人，但本事很厉害。&lt;page&gt;如果有掠食者靠近，她的本领能让我们旅团安心不少。
TROUPE_HUNTER_MEET_NOMAP_ACT3,"You remain, bug not flea? Would you seek service of me, ehh? Mine is knowledge much, the places of the lost little ones, heard and smelt across the caves.&lt;page&gt;You could help find! And bring! For all to come together now that times turn dark...&lt;page&gt;But no map you hold! If learnings are wanted, a map must be owned. Until then, we have no trade to make.",你还在这里，虫子，不是跳蚤？想让我帮忙吗？我知道那些失落小家伙的位置，听闻和嗅到过遍布洞穴。&lt;page&gt;你可以帮忙找到！带他们来！现在黑暗降临，大家最好团聚……&lt;page&gt;但你没有地图！想要情报，得先有地图。在那之前我们没什么可谈的。
TROUPE_MEMBER_SHORT_REPEAT_FLEATOPIA_ACT3,"Our travels have end, and now soon the world will also have end! At such bitter of times, brew with friends is most sweet.",旅途结束了，世界也快结束了！在这样苦涩的时刻，和朋友一起喝药酿最甜美。
CARAVAN_LECH_INTRO,"&lt;hpage&gt;Greetings again, sir flea. I see you were able to unite safely with this caravan.&lt;page&gt;Oh yes! All thanks to you! Dear, sweet you! Heh heh!&lt;page&gt;The Fleamaster, that old bore, tells me to call you Miss Hornet. But such a prickly name ill befits such a delicate beauty! Shall I call you something prettier, like &#8216;Nectarsweet&#8217;, my dear?&lt;hpage&gt;You shall not. Address me by my name or not at all.&lt;page&gt;Gradak! Of course. Of course! Heh heh. And now, I shall let you in on my little secret. My carriage doubles as a soothing spa, you see. It&#8217;s most ingenious.&lt;page&gt;The water inside is piping hot, and purer than a psalm! Heh heh! I&#8217;d gladly let you soak inside, for a modest fee!",&lt;hpage&gt;又见面了，跳蚤先生。看来你顺利加入了旅团。&lt;page&gt;是啊！全靠你！亲爱的，甜美的你！嘿嘿！&lt;page&gt;跳蚤首领那老古板让我叫你大黄蜂小姐。但这么刺的名字配不上你这般美丽！要不要叫你“蜜糖甜心”呢？&lt;hpage&gt;不许。要么叫我的名字，要么别叫。&lt;page&gt;咳！当然，当然！嘿嘿。现在告诉你个小秘密——我的车厢其实也是温泉疗愈所，很巧妙吧。&lt;page&gt;里面的水又烫又纯净，比圣诗还纯！只要付点小钱就能泡个痛快！
FG_BOUNCE_INTRO_FIRST,"Dear one, how shameful for the world to end while poor Kratt still has so much living left in him!&lt;page&gt;But how sweet of you to join me here! Will you play the Flea Bounce game, that I may appreciate the beauty of your agile form while I await my doom?&lt;page&gt;To play is simple. Leap up and keep bouncing on the fleas who fly past for as long as you are able!",亲爱的，世界就要终结，可怜的克拉特还没活够！&lt;page&gt;但你能来陪我真好！要不要玩跳蚤蹦蹦？让我欣赏你灵巧的身姿，等着末日降临。&lt;page&gt;玩法很简单。跳起来踩飞过的跳蚤，能坚持多久就多久！
TROUPE_MEMBER_TALL_REPEAT_GREYMOOR,Strange beasts prowl these grey lands. I hear them roar and shriek outside camp. Is best to stay inside and make quiet.,这些灰地里有奇怪的野兽出没。我常听到它们在营地外咆哮。最好待在营地里安静点。
FG_DODGE_CHOICE,Compete in Flea Dodge?,参加跳蚤溜溜？
TROUPE_MEMBER_SHORT_MEET_FLEATOPIA,"At longest last, have our flea roamings ended! Every sandy grain and stinky squelchy maggot was worth to endure, to claim such a home!&lt;page&gt;Is time for rest and celebrate, and none have earned such more than you, Miss Hornet! Raise your flask and drink most heartily with us!",终于结束了跳蚤的流浪！吃沙子、喝脏水、忍蛆虫都值了，终于有了家！&lt;page&gt;是时候休息和庆祝了，大黄蜂小姐！和我们一起举杯畅饮吧！
TROUPE_LEADER_GREYMOOR_REPEAT,We will camp here in these grey lands until more fleas find their way to the caravan. Please lend your aid to any of our fellows you find lost out on the roads!,我们会在这片灰地扎营，直到更多跳蚤归队。请帮忙寻找在外迷失的同伴！
TROUPE_LEADER_ACCEPT_QUEST_OUTRO,"&lt;hpage&gt;I am travelling these lands for my own reasons, Fleamaster. However, if I happen upon any fleas on my travels, I will aid them as best I can.&lt;page&gt;Oh, oh I could ask for nothing more! They must all be hiding or stuck in dangerous places, but if you rouse them they are sure to find their way here to us.&lt;page&gt;May the kingdom bless your travels and keep you safe, stranger! You are welcome to rest here with us whenever the roads bring you back!",&lt;hpage&gt;我有自己的旅途要走，跳蚤首领。但如果途中遇到跳蚤，我会尽力帮忙。&lt;page&gt;噢噢，这就足够了！他们肯定都藏在危险的地方，但只要你唤醒他们，他们一定会自己找到这里。&lt;page&gt;愿王国保佑你旅途平安，外乡人！你随时都欢迎回来休息！
TROUPE_LEADER_GREYMOOR_MEET_TRAVELED,"The journey here was long, but we didn&#8217;t lose a single flea! I&#8217;m told it&#8217;s good luck to bring a guest along when travelling, so we must have you to thank!&lt;page&gt;I trust the trip was agreeable for you. A pleasure perhaps? Nestled in with our dear little ones...&lt;hpage&gt;They certainly make for energetic travel companions. I&#8217;ve not often had opportunity to socialise with such spirited sorts.&lt;page&gt;Splendid! And now, you must go and see Grishkin, sitting there by the bubbling cauldron. After long travel, we drink to revive our spirits!",这一路很长，但我们一只跳蚤都没丢！据说带贵客同行会带来好运，肯定多亏了你！&lt;page&gt;旅途还顺利吗？和小家伙们挤在一起还开心吗？&lt;hpage&gt;他们确实很有活力，我很少和这么精神的旅伴一起旅行。&lt;page&gt;太好了！现在你该去找格里什琴了，她就在冒泡的大锅旁。长途跋涉后该喝点提神的！
TROUPE_MEMBER_SHORT_BREW_FULL,"Miss Hornet, your bottle is full of Flea Brew. You know what such means! You must have drink! Har har!&lt;page&gt;When you have finish drinking, return and we will fill flask again! I&#8217;m is always brewing!",大黄蜂小姐，你的药酿瓶满了。你知道这意味着什么！得先喝掉！哈哈！&lt;page&gt;喝完了再回来找我！我这儿药酿管够！
TROUPE_MEMBER_SHORT_REPEAT,"My fellows give much worry for the other fleas, but I&#8217;m not give at all. They will find their way to us, and if not, who keep count of them anyway? Har har!",我的同伴们总是担心其他跳蚤，但我一点都不担心。他们会自己找到这里，没来的谁会去数呢？哈哈！
TROUPE_LEADER_JUDGE_REWARD,"Ahh, and before the road steals you away from us again, allow me to offer you a humble gift!&lt;page&gt;One of the little ones found a pale artefact while digging about in the sands. A spiny, cold sort of thing.&lt;page&gt;I see no use in it for we fleas, so of course we are all too pleased, eager even, to bestow it upon our dear friend!",啊，在你再次踏上旅途前，请收下这份薄礼！&lt;page&gt;有个小家伙在沙地里挖到一件苍白的古物，冰冷又带刺。&lt;page&gt;对我们跳蚤没用，正好送给挚友！
TROUPE_LEADER_DELIVERY_FLEATOPIA_POST,"For your hard efforts and eternal friendship, please accept these meagre rosaries as reward.&lt;page&gt;Think of we fleas when you find chance to trade them!",感谢你的努力和永远的友谊，请收下这些念珠作为奖励。&lt;page&gt;有机会用到时，别忘了我们跳蚤！
CARAVAN_LECH_TALK_ACT3,"Dear one, my lone light amongst the darkness! Will you bathe in Kratt&#8217;s spa-carriage and let the warm waters wash away your worries?",亲爱的！黑暗中的明灯！要不要来克拉特的温泉车厢泡个澡，让温暖洗去烦忧？
CARAVAN_LECH_SPA_ACCEPT_2,"Please, my dear, step inside! I will stand guard here while you bathe... Right on this very spot!",请进吧，亲爱的！你泡澡时我就在这守着……寸步不离！
TROUPE_MEMBER_TALL_MEET_GREYMOOR,"Dodeshna. Want for shelter from the thick, grey air? Is heavy, and wet. I&#8217;m worry for the little flea&#8217;s health in this land.&lt;page&gt;And they make play in the filthy water. I say them stop, but they just laugh and splash on me. They are lack respect!&lt;hpage&gt;Most bugs instinctively obey those with strength and will. Speak with authority, or your commands may go unheeded.&lt;page&gt;Ugh... really, is Fleamaster&#8217;s job to teach the fleas such. I will just have rest here until is time to move on.",多德什纳。要来避避这厚重的灰气吗？又闷又湿。我担心小跳蚤们在这里会生病。&lt;page&gt;他们还在脏水里玩。我让他们别玩，他们只会笑着把水溅我一身。真没规矩！&lt;hpage&gt;大多数虫子天生服从强者。你得用权威口吻说话，否则没人听。&lt;page&gt;唉……其实教他们是跳蚤首领的事。我还是休息等出发吧。
FG_DODGE_DECLINE,"Away then, bug. Await challenger, shall I.",那就走吧，虫子。我会等下一个挑战者。
FG_BOUNCE_COMPLETED,"Vikna! Our little game has ended. But I trust, after a short rest, you will play with us again?",维克纳！游戏结束。不过我相信你休息一下还会再来玩吧？
FESTIVAL_BOARD_TITLE_JUGGLE,Juggle,跳蚤耍耍
TROUPE_LEADER_ACCEPT_QUEST1,"Ahh! Do I understand you rightly, stranger? You will help gather the lonely fleas to our caravan? Truly?",啊！我没听错吧，外乡人？你愿意帮忙召集失落的跳蚤加入旅团？真的吗？
TROUPE_LEADER_MEET_FLEATOPIA,"Miss Hornet! Our saviour! How dearly we had hoped you would visit.&lt;page&gt;And just look! This beautiful spot you&#8217;ve gifted us, safe apart from the dark and death of the lands beside. A place for fleas to grow smart and strong.&lt;page&gt;Here we shall see our travels end, for in Pharloom there could be no finer place to settle.&lt;hpage&gt;I am glad the location suits, Fleamaster. It is a calming thing to know these many fleas may survive. Most bugs of Pharloom seem destined for far bleaker fates.&lt;page&gt;Indeed! A hopeful future awaits! And only because of yourself and your efforts. To commemorate our arrival, it would be my pleasure to perform a small service for you.&lt;page&gt;
I have been learning to sew, and the little fleas have been gathering materials for me. I thought I could add an extra pocket to your tool pouch, to make your travels just a little easier.&lt;page&gt;
A trifling favour, much less than you deserve, but still I hope it meets to your satisfaction!",大黄蜂小姐！我们的救星！我们一直盼着你来。&lt;page&gt;看看这块宝地！远离黑暗和死亡，跳蚤们能在这里茁壮成长。&lt;page&gt;这里就是我们旅途的终点了，纺络再没有更好的归宿。&lt;hpage&gt;很高兴你们喜欢这里，跳蚤首领。能让这么多跳蚤幸存下来，真让人安心。纺络的大多数虫子都没这么幸运。&lt;page&gt;没错！未来充满希望，这都多亏了你。为纪念乔迁之喜，我想为你做点小事。&lt;page&gt;我最近在学缝纫，小跳蚤们帮我收集材料。我想给你的工具袋加个口袋，让旅途轻松些。&lt;page&gt;区区薄礼，不足挂齿，但希望你喜欢！
TROUPE_LEADER_GAMES_INTRO_REFUSE,"&lt;hpage&gt;I know not what you plan, Fleamaster, and at this time I cannot participate.&lt;page&gt;Ahhhh. Ahhhhhhh! Wretches, wretches, all of us! How can we begin without you, dear friend?",&lt;hpage&gt;我不知道你打算做什么，跳蚤首领，但现在我无法参加。&lt;page&gt;啊啊啊！可惜啊！我们这些可怜虫没有你，怎么开始庆典？
FESTIVAL_OUTRO_SCENE,"Gathered here we are, to honour the grand champion of this very final of all festivals!&lt;page&gt;Now, Miss Hornet! Strike the great effigy with all your might!",我们聚集于此，为这最后的庆典加冕总冠军！&lt;page&gt;大黄蜂小姐，现在请全力击打巨像！
TROUPE_MEMBER_SHORT_REPEAT_FLEATOPIA,The little fleas like this place most of all. They are as much happy as I ever hear them!,小跳蚤们最喜欢这里了。我从没见他们这么开心过！
TROUPE_LEADER_ALLRESCUED_INTRO_FULL_EARLY,"Oh dear friend, Miss Hornet, look at our marvellous troupe! Their numbers full. Their spirits bright. All thanks to your heroic efforts!",亲爱的朋友，大黄蜂小姐，快看我们壮盛的队伍！跳蚤们一个不少，个个精神饱满，全靠你的英勇相助！
FG_BOUNCE_CHOICE,Compete in Flea Bounce?,参加跳蚤蹦蹦？
TROUPE_LEADER_MEET_JUDGE_TRAVELED,"Another journey complete! And a new, high spot for our rest, upon the doorstep of that mighty Citadel, no less!&lt;hpage&gt;It is fortunate that all of your companions survived the trek, Fleamaster. The howling rise beside, and the tangled wood before it, have both claimed the lives of countless bugs.&lt;page&gt;Indeed! A perilous ascent! Maybe it was your company that brought us luck, Miss Hornet? It surely put us fleas at ease to have you and your weapon riding close.",又一段旅程结束了！这次竟然停在圣堡门廊这样的高处！&lt;hpage&gt;你们能平安抵达这里实属幸运，旁边的峭壁和前面的丛林都葬送过无数虫子。&lt;page&gt;确实危险！也许是你带来了好运，大黄蜂小姐？有你和你的武器同行，大家都安心不少。
TROUPE_LEADER_ALLRESCUED_INTRO_ALT,"Oh and look, Miss Hornet, look at how many lost fleas have come! It seems even the last few stragglers are now with us.",噢对了，大黄蜂小姐快看！这么多失落的跳蚤同胞，连最后几个掉队的都回来了！
TROUPE_LEADER_MEET_1,"Ah! Aha! A native of these fiery lowlands approaches! Have no fear, my friend, we fleas are but humble travellers!&lt;hpage&gt;Well met sir, though like you I am not of these lands. I am merely journeying through.&lt;page&gt;Oh. Oho! A kindred spirit! It&#8217;s good luck for wanderers to meet on an unfamiliar path.",啊哈！是这片灼热低地的原住民！别怕朋友，我们跳蚤只是卑微的旅者！&lt;hpage&gt;幸会，不过我和你一样只是路过此地。&lt;page&gt;噢！原来也是旅者！听说流浪者在陌生路上相遇是好兆头！
CARAVAN_LECH_TALK,"Dodeshna, dear one, dodeshna! Heh heh! Have you returned to use Kratt&#8217;s luxurious spa-carriage? I&#8217;ve kept it roastily warm for you...",多德什纳，亲爱的，多德什纳！嘿嘿！要来泡克拉特的豪华温泉车厢吗？我一直为你温着呢！
FG_JUGGLE_COMPLETED_HIGHSCORE,"Vikna! The game is now ended, and the Flea Juggle champion has set an even higher score! Tremble in awe, dear fleas, at the might of our dear Miss Hornet!",维克纳！游戏结束，跳蚤耍耍冠军刷新了记录！跳蚤们，见识一下大黄蜂小姐的实力吧！
TROUPE_LEADER_INCOMPLETE_QUEST1,"There are many lost and lonely fleas still scattered across this kingdom. If only some more of them joined us, the caravan could continue its journey.&lt;page&gt;You&#8217;ll find the little dears in all sorts of strange places, for they love to peek and pry and play, but if you rouse them they are sure to find their way here!",还有很多失落的跳蚤散落在王国各地。如果能再多召集一些，旅团就能继续前行。&lt;page&gt;这些小家伙喜欢藏在各种奇怪的地方，但只要你唤醒他们，他们一定会自己找到这里！
TROUPE_MEMBER_TALL_FLEATOPIA_REPEAT_ACT3,"Those great rumbles from beneath, they are have sound similar to giant beast. Such beast is much sorrowful though, I am think.&lt;page&gt;Fleas and monsters alike have their troubles...",下面传来的轰隆声，像巨兽的哀嚎。也许长得越大，悲伤也越大吧。&lt;page&gt;跳蚤和怪物都有各自的烦恼……
HORNET_FLEA_LAKE_FOUND,&lt;hpage&gt;The Fleamaster and his caravan sought for caves offering space and safety. This calm lake and shore may prove suitable.,&lt;hpage&gt;跳蚤首领和他的旅团一直在寻找宽敞又安全的洞穴，这片湖岸或许很合适。
TROUPE_LEADER_JUDGE_READYTOLEAVE,"Oh, Miss Hornet! Wonder at how large our caravan has grown! So bold and boisterous! This gilded chamber can barely contain us all!&lt;page&gt;The many fleas are itching to journey once more, to find a space to stretch their wings. But from here, as their leader, I am hesitant to order us so swiftly away.&lt;page&gt;These heights hold too much danger to set forth without a safe goal held clear in mind.&lt;page&gt;What of you, Miss Hornet? Your tasks carry you throughout this kingdom. Have you ever encountered a place appropriate?",大黄蜂小姐！看看我们旅团现在多壮大！热闹非凡！这金色大厅都快装不下了！&lt;page&gt;大家都急着再次出发，想找个宽敞的地方。但作为领袖，我不敢贸然行动。&lt;page&gt;高地危机四伏，没有明确目标不能冒险。&lt;page&gt;你呢，大黄蜂小姐？你的任务走遍了纺络，可曾遇见合适的地方？
TROUPE_LEADER_REPEAT_GENERIC,"We will camp here a time before moving onward. These moments of safety and calm must be treasured, rare as they are.",我们会在这里暂驻一段时间。这难得的安宁时光要好好珍惜。
TROUPE_LEADER_ALLRESCUED_INTRO,"Oh my dear friend, Miss Hornet, look now at how many of the lost fleas have come! It seems even the last few stragglers are now with us.",亲爱的朋友，大黄蜂小姐，快看有多少失落的跳蚤同胞回来了！连最后几个掉队的都回来了！
TROUPE_LEADER_MEET_2,"And now that we have met, know that I am Fleamaster Mooshka, leader of this caravan!&lt;page&gt;Our own journey has barely begun, but you are most welcome to tarry here a while, stranger. Where ways are dark and winding, good bugs must stay close together!",既然相遇，请记住——我是跳蚤首领穆什卡，旅团领袖！&lt;page&gt;我们旅途才刚刚开始，但欢迎你在此歇息。外面黑暗又危险，好虫子要抱团取暖！
TROUPE_MEMBER_SHORT_MEET_JUDGE,"The bellowing sandy land was full of much danger. We was almost lost poor Varga to hungry worms as we travel up!&lt;page&gt;Sadly, he is finding way here after all. Har! Is only jest. Grishkin and Varga is great friends, just like all fleas is being.",这片沙地非常危险。我们差点在路上把瓦尔加丢给了饿虫！&lt;page&gt;可惜最后他还是找到了路回来。哈哈，开玩笑，格里什琴和瓦尔加可是好朋友，就像所有跳蚤一样。
BREW_REFILL_PROMPT,Refill Flea Brew?,装满跳蚤药酿？
TROUPE_HUNTER_ALL_FLEAS_FOUND,"You have brought them all, bug not flea. My work is done! No more searching needed. Ours is a caravan full!&lt;page&gt;Now my duty must change. To watch. To protect. This new task I am looking much to liking.",你把他们全带来了，虫子，不是跳蚤。我的工作完成了！不用再找了，旅团满员！&lt;page&gt;现在我的任务变了，要守护，要保护。这新差事我很喜欢。
TROUPE_MEMBER_TALL_RETURN,"Is warm here, you agree? Is very... what is say, cosy?&lt;page&gt;The Fleamaster though, is always want to move on. We will be drag away somewhere much worse soon, I think.",这里很暖和，你觉得呢？很……温馨？&lt;page&gt;不过跳蚤首领总想搬家，我猜很快又要去更糟的地方了。
CARAVAN_LECH_SPA_DECLINE,"Oh... what a shame. Heh heh! I think you&#8217;d find the waters inside delectably soothing, if you&#8217;d only reconsider!",噢……真遗憾。嘿嘿！你要是试试里面的水，一定会觉得很舒服，要不要再考虑一下？
TROUPE_LEADER_DELIVERY_FLEATOPIA,"&lt;hpage&gt;Fleamaster, I bring a delivery, supplies from the couriers of Bellhart to aid your settlement.&lt;page&gt;Such dedication you continue to show us, Miss Hornet!&lt;page&gt;While we may seem safe out here at range from danger, we cannot go far to forage, and the many fleas need much nurture!&lt;page&gt;Food and provisions, such as you bring, are crucial in these desperate times.",&lt;hpage&gt;跳蚤首领，我带来了钟心镇的补给，支援你们的定居点。&lt;page&gt;大黄蜂小姐，你一直这么照顾我们！&lt;page&gt;虽然这里看似安全，但我们很难远行觅食，这么多跳蚤需要照顾！&lt;page&gt;你带来的食物和物资在这艰难时刻至关重要！
FG_DODGE_INTRO_REPEAT,"This trial is Flea Dodge. Stay upon platforms, avoid attacks. Longer stay gives bigger score.",这就是跳蚤溜溜。站在平台上，躲避攻击。坚持越久分数越高。
TROUPE_MEMBER_SHORT_MEET,"Dodeshna, dodeshna! I am saying, welcome to our caravan, stranger!&lt;page&gt;You are a very funny, very strange flea, isn&#8217;t it? No fur at all, and your wings fall off!&lt;page&gt;Har, har har har! Is just jest, of course. Us fleas famous for giving jokes!",多德什纳，多德什纳！欢迎加入我们的旅团，外乡人！&lt;page&gt;你真是个滑稽又奇怪的跳蚤，对吧？没毛还掉翅膀！&lt;page&gt;哈哈哈！只是开玩笑啦。我们跳蚤最爱开玩笑！
TROUPE_MEMBER_SHORT_RETURN,"Some beasts here, I see them eat through the bony ground. Is very smart! Bone is everywhere much abundant! If only I had such stomach, har har!",这里有些野兽会啃地上的骨头，真聪明！骨头到处都是！要是我有那胃口就好了，哈哈！
TROUPE_MEMBER_SHORT_REPEAT_FESTIVAL,"Drink to full, Miss Hornet! Why waste? Be merry with us fleas before it all ends!",喝个痛快吧，大黄蜂小姐！为什么要浪费？末日将至，和我们跳蚤一起尽情欢乐吧！
FG_DODGE_COMPLETED_HIGHSCORE,"Vikna. The trial has ended and you have bested your old score. Rishkiz, champion!",维克纳。试炼结束，你刷新了旧纪录。里什基兹，冠军！
TROUPE_LEADER_OFFER_QUEST1_REPEAT,"Normally I would never burden a visitor with the caravan&#8217;s worries. But! Isn&#8217;t it the custom of this kingdom to share your deepest wishes with strangers?&lt;page&gt;Well, my wish is for the poor lost fleas of these lands to find their way to our caravan! Stranger, could you not help us?",我本不会让客人操心旅团的烦恼。但！在这个王国，向陌生人倾诉愿望不是风俗吗？&lt;page&gt;我的愿望就是让这些可怜的失落跳蚤都能回到旅团！外乡人，你能帮帮我们吗？
TROUPE_LEADER_JUDGE_CANLEAVE,"&lt;hpage&gt;Fleamaster, if your troupe is still prepared to travel, I have discovered a cave beyond the Citadel, at the edge of some ancient aqueducts. That place may well suit your needs for safety.&lt;hpage&gt;The trek would be long, but once reached you will find a sandy shore, free of predators, beside a wide clear lake. It is as peaceful a place as I&#8217;ve seen throughout these fraught lands.&lt;page&gt;That&#8217;s it! It must be! Our destination has at last been set. Our journey can continue!&lt;page&gt;True friend of fleas you are, Miss Hornet. That place shall welcome us, no doubt. Will you be joining for this new journey?",&lt;hpage&gt;如果你们旅团还准备好出发，我发现圣堡外的古渠尽头有个洞穴，也许适合你们安身。&lt;hpage&gt;路途虽远，但到了那里你会发现有沙滩湖泊，没有掠食者。这是我在这片土地见过最安宁的地方。&lt;page&gt;就是那里！终于有目标了，旅团可以继续前进！&lt;page&gt;你真是跳蚤的挚友，大黄蜂小姐。那地方肯定很适合我们。愿意和我们一起踏上新旅程吗？
