Key,EN,ZH
FG_JUGGLE_COMPLETED_CHAMP_TO_OUTRO,"Vikna! The game is ended, and we have a new Flea Juggle champion! Incredible!&lt;page&gt;You have proven yourself the champion at each of our flea games!&lt;page&gt;I am confident now that the grand champion of our festival has emerged. It is none other than yourself, of course!&lt;page&gt;And thusly, must our final ceremony begin. Fleas, prepare yourselves!",维克纳！游戏结束，新的跳蚤耍耍冠军诞生了！太强了！&lt;page&gt;你包揽了所有跳蚤游戏的冠军！&lt;page&gt;我现在可以宣布，你就是庆典的总冠军！&lt;page&gt;最终仪式现在开始！跳蚤们，做好准备！
TROUPE_HUNTER_CANCELED,"You not want my learnings, bug not flea? Rare it is we share such things with ones outside our own.",你不想要我的情报，虫子，不是跳蚤？我们很少和外族分享这些。
FG_JUGGLE_CHOICE,Compete in Flea Juggle?,参加跳蚤耍耍？
FG_JUGGLE_INTRO_CHAMP,"Miss Hornet, you are the greatest of us all in the Flea Juggle! But will you challenge yourself to ever higher achievements?",大黄蜂小姐，你是跳蚤耍耍之王！要挑战更高纪录吗？
TROUPE_MEMBER_TALL_MEET,"Dodeshna, stranger. You are looking a little... tired, is it? Unhealthy?&lt;page&gt;You can rest with us here, if wish. Is nice and dark, and warmth from below brings good health.&lt;page&gt;Still, you should make care not to stay much long. You are not flea, after all.",多德什纳，外乡人。你看起来有点……累？不太健康？&lt;page&gt;你可以留下和我们一起休息。这里又暗又暖，很适合养生。&lt;page&gt;不过别待太久，毕竟你不是跳蚤。
TROUPE_HUNTER_WILD_REPEAT_NOCARAVAN,"You still here, bug? Is rest I need before I travel. Not chat. You is trouble-type. Make my shell tense.&lt;hpage&gt;I shall take my leave, madam. Stay strong on your own journey. May we meet again in more hospitable surrounds.",你怎么还在，虫子？我得休息一会再上路。不想聊天。你是麻烦型，让我甲壳发紧。&lt;hpage&gt;那我就告辞了，女士。祝你一路顺利，希望下次能在更好的地方再见。
TROUPE_LEADER_GREYMOOR_CANLEAVE_FULL,"Look Miss Hornet! See the many lively fleas that form our caravan. Thanks to you and your hunting, so many are here! And all are eager again to travel!&lt;page&gt;We had once wished to match the numbers of our fabled past, yet now, we may even have exceeded them!&lt;hpage&gt;It is a welcome sight, Fleamaster, and the playful cheer about the caravan suggests you are a fine steward to the troupe.&lt;page&gt;Such kind words, Miss Hornet! How lucky we are to have found a friend so fair!&lt;page&gt;But now, we must away! These moors have been our host long enough. It is time to climb and hoist towards drier caves!&lt;page&gt;Good friend to fleas, would you join us on this next journey?",请看，大黄蜂小姐！这么多活蹦乱跳的同胞加入！多亏您帮忙，队伍越来越壮大。大家都盼着再度启程！&lt;page&gt;我们曾奢望恢复传说中的旅团规模，而现在或许已经超越了传说！&lt;hpage&gt;看见这么多跳蚤平安无事，我也很欣慰。他们的欢声笑语也证明了你是个称职的领队。&lt;page&gt;大黄蜂小姐过奖了！能结交您这样的朋友才是旅团的幸运！&lt;page&gt;但现在该启程了！沼地虽好，但不应久留，该向更干燥的洞窟进发了！&lt;page&gt;跳蚤之友，愿意与我们一起出发吗？
TROUPE_LEADER_JUDGE_TRAVEL,Marvellous! We fleas shall be overjoyed to have your company on the road.&lt;page&gt;Now! Our new home is calling. We must travel!,太好了！跳蚤们肯定会为与你同行而欢呼！&lt;page&gt;现在！该向着新家进发了！
TROUPE_MEMBER_SHORT_REPEAT_GREYMOOR,"I&#8217;m wonder at this land... Something heavy hangs above, like shadow. I&#8217;m hope the little fleas have not much danger here...",这地方不对劲……总觉得天上有黑影压着。但愿小家伙们别出事……
TROUPE_LEADER_ACCEPTED_WISHWALL_QUEST1,"&lt;hpage&gt;Fleamaster, I took your request from the wishwall in the pilgrim camp. You are seeking fleas to join your caravan?&lt;page&gt;Oh, yes! The time has come for us fleas to find each other and travel together, as has happened through generations before.&lt;page&gt;The many fleas of this kingdom should be flocking to our caravan, but times have become dangerous. You feel it too, yes? Our poor cousins, out there, in hiding!&lt;page&gt;But... do I understand you rightly, stranger? You will help find the the poor, lost fleas? Truly?",&lt;hpage&gt;跳蚤首领，我在朝圣营地看到了你的祈愿。你要召集跳蚤加入旅团？&lt;page&gt;正是！跳蚤们该像祖辈那样聚首同行了。&lt;page&gt;本该有无数同胞来投奔旅团，可如今危机四伏，您也感受到了吧？可怜的同胞们还在外躲藏！&lt;page&gt;但……您真的愿帮忙寻找我们迷途的同胞？当真？
TROUPE_LEADER_GREYMOOR_HAUNTEDBELLHART,"That great vein of bells there... some of the fleas wanted to shelter inside, but I was not so sure. The whole creaking mass seems unstable! It makes me tremble!&lt;hpage&gt;You were wise not to head inside, Fleamaster. A silken curse has taken hold of the settlement within. Advise your fellows to avoid that place.&lt;page&gt;A curse you say?! W-well then! Our thanks are owed again. I shall let all fleas know they must not venture closer.",那串巨钟……有些跳蚤想躲进去，但我总觉得不牢靠！看着就发颤！&lt;hpage&gt;不在里面扎营是明智之举。那里已被丝咒侵蚀，告诫同胞远离为妙。&lt;page&gt;丝咒？！那……那可要多谢提醒！我这就通知大伙别靠近。
FG_DODGE_COMPLETED,Vikna. The trial has ended. Your score can be seen on the board beside me.,维克纳，试炼结束。成绩在我身旁的榜上。
