Key,EN,ZH
BS_SIT_QUEST2_COMPLETE,"The mossblood... The Plasmium. It demands that foreign, lesser life... It demands violent coercion...&lt;page&gt;You have done so well, Assistant... For your kind efforts, you may relieve this shell of its rosaries. They are heavy, mortal things... On a transcending shell, they will only weigh...",mossblood ...质子。它要求外国，较少的生活...它需要暴力胁迫...＆lt; page＆gt; appects and Assistant ...为了您的善良，您可能会减轻其念珠。它们是沉重的致命事物...在超越的外壳上，它们只会称重...
BLUE_SCIENTIST_Q2_CANCOMPLETE,Assistant! How goes your latest task? Have you extracted a sufficient amount of mossblood for me?,助手！您的最新任务如何？您是否为我提取了足够数量的Mossblood？
BLUE_SCIENTIST_QUEST2_REOFFER,"Assistant! If you&#8217;re wanting more rosaries to fill your pockets, then aid me with the collection of mossblood from the caves below.&lt;hpage&gt;",助手！如果您想让更多念珠填满您的口袋，那么请从下面的洞穴中收集Mossblood。
QUEST_CORAL_INV_DESC_READY,Turn in the Coral Crust to the Bellhart wishwall and collect the reward.,将珊瑚壳转移到贝哈特的Wishwall并收集奖励。
CARAVAN_SPIDER_TALK_THREAD,(No longer needed. Remove.),（不再需要。删除。）
PILGRIM_STOMPER_QUEST_DECLINE,"You refuse me as well then, like all the others? You do these wretches no favour by allowing them to wander mindlessly!",那么，您也像其他所有人一样拒绝我吗？您可以通过允许它们无意识地漫步来做这些遗憾！
PILGRIM_STOMPER_QUEST_REOFFER,"I wish to understand what haunts these pilgrims, and to do that I must peer into their bodies. Their organs hold the secret of their terrible affliction! You must harvest them for me!",我想了解这些朝圣者的困扰，并做到这一点，我必须窥视他们的身体。他们的器官掌握了他们可怕的痛苦的秘密！你必须为我收获它们！
CARAVAN_SPIDER_MEET_CORAL,"Well well. I&#8217;ve not seen this old stop in many a beat. You have my thanks for clearing it.&lt;hpage&gt;The coral overgrowth has grown wild. The bug built structures about these climes are subsumed beneath it. &lt;page&gt;I&#8217;d heard the coral was always a hard thing to keep under control, even back when the place was well travelled.&lt;page&gt;Now there&#8217;s no one left to tend the path, it&#8217;s no surprise so few pilgrims find their way through.",好吧。我没有在许多节拍中看到这个旧站。您非常感谢您清除它。关于这些气候的错误结构被包含在其下面。＆lt; page＆gt; i＆＃8217; d听说珊瑚总是很难控制的事情，即使在这个地方走得很好的时候也回来了。
LACE_REMEET_GROTTO_2,"I can save you little spider. All the trouble you&#8217;d face above. All the suffering. Its so simple.&lt;page&gt;I&#8217;ll just skewer you here and now, pluck that flickering life right out of you.&lt;hpage&gt;Your threats are worthless. If you are my foe, stay your voice and raise your blade!",我可以节省小蜘蛛。您上面面对的所有麻烦。所有的痛苦。它是如此简单。如果您是我的敌人，请保持声音并举起刀片！
