Key,EN,ZH
NOTE_ROACHFEEDER_TALL,"The feeder&#8217;s curled pin looks designed to keep ravenous roaches at bay, and the tender from turning into the meal.",喂食器卷曲的销钉看起来旨在防止狂欢的蟑螂避开，而嫩的脚又变成了饭菜。
NAME_BLUE_ASSISTANT,Plasmified Zango,质量的zango
NOTE_ABYSS_MASS,"A creature born of a bug&#8217;s desperate hope for strength. Few possess the skill to call the void, and of those that can, none possess the means to tame it.",一个由虫子出生的生物＆＃8217;对力量的迫切希望。很少有人具备称为空白的技能，而在那些可以驯服它的技巧的技能中，没有人拥有驯服它的手段。
DESC_CORAL_SPIKE_GOOMBA,Dark-furred bug protecting itself with a spiked coral nut.,深色的虫子用尖刺的珊瑚螺母保护自己。
DESC_ROOF_CRAB,Thick-plated scuttler that prefers high places.,厚厚的雪橇板更喜欢高处。
NAME_SETH,Shrine Guardian Seth,卫生卫士塞思
DESC_UNDERSTORE_POKER,"Drained worker on the verge of collapse. Consumed by the Haunting, they continue to work far beyond their mortal limits.",陷入崩溃的边缘。由于困扰着困扰，他们继续远远超出了他们的致命限制。
DESC_SWAMP_MUCKMAN,Cunning bug that hunts with darts fashioned from stake and bile.,狡猾的虫子与飞镖一起狩猎，从危险和胆汁中制成。
NOTE_ABYSS_TENDRIL,The void that will claim all things... In the barbed forms it chooses its nature can be seen clear.,可以清楚地看到将要声称所有事物的空隙。
DESC_SONG_AUTOMATON_SHIELD,"Cogwork construct forged primarily for the Core&#8217;s protection. Bears a shield and poke-pin, and possesses a lethal understanding of their use.",COGWORK构建主要用于核心保护。带有盾牌和戳针，并对它们的使用具有致命的理解。
NOTIFICATION_HALF,New Journal Entry,新期刊条目
NAME_SLAB_FLY_SMALL_FRESH,Freshfly,Freshfly
NAME_FLOWER_QUEEN,Nyleth,尼尔
DESC_BONE_CRAWLER,Small boney bug that favours dark tunnels. Can expand its spiked carapace to ward against attacking predators.,有利于黑暗隧道的小boney虫。可以扩大其尖刺的甲壳以防止攻击掠食者。
NAME_RHINO,Rhinogrund,鼻
NOTE_PILGRIM_STAFF_UNDERSTORE,Their sharp cleaning implement is as filthy as the rest of the place. They only layer grime on grime.,他们的清洁工具和其他地方一样肮脏。它们仅在污垢上涂层污垢。
DESC_SONG_REED_GRAND,"High standing insect of the Choir, bearing a bow. This elite Reed has been trained and fed beyond its smaller fellows.",合唱团高高的昆虫，带有弓。这位精英里德（Reed）经过了较小的同伴的训练和喂养。
NOTE_SONG_CREEPER,"It lies low to the ground, perhaps out of reverence for its task, but can spring up suddenly to attack. Its shear makes for a deadly weapon with surprising reach.",它靠在地面上，也许是出于对其任务的崇敬而出于崇敬，但可能会突然出现攻击。它的剪切件使致命的武器具有惊人的范围。
DESC_UNDERSTORE_AUTOMATON_EX,"Small automaton with a shielded shell, intended to carry loads of dangerous flintflame.",带有屏蔽外壳的小型自动机，旨在携带大量危险的flintflame。
NOTE_GARMOND_ZAZA,"They too seek the spectre at the Haunting&#8217;s heart, though I fear that foe would pose a challenge beyond their mortal limits.",他们也在困扰着幽灵的心中寻求幽灵，尽管我担心敌人会在他们的致命极限之外构成挑战。
NOTES_DEFEAT,Defeat {0} more to complete the hunter&#8217;s notes.,打败{0}更多以完成猎人的笔记。
NAME_ARBORIUM_KEEPER,Memoria,纪念
DESC_CORAL_CONCH_SHOOTER,Nesting creature that fuses its face with sharpened coral.,嵌套生物与尖锐的珊瑚融合。
NOTE_PILGRIM_MOSS_SPITTER,"The moss looks to grow even inside their stomach, which the pilgrim spits at foes in compressed gobs. A foul form of offence.",苔藓看起来甚至在他们的胃中生长，朝圣者在压缩的gob中吐出敌人。犯规形式。
DESC_SONG_AUTOMATON_BALL,Rare automaton intended to perform the ringing of bells and cymbals in the depths of the Core.,罕见的自动机旨在在核心深处执行铃铛和c响。
DESC_SONG_PILGRIM_03,"Disciple of the Choir, elevated above other pilgrims, and forced to cowl their face forever more.",合唱团的门徒被抬高到其他朝圣者之上，并被迫永远围着他们的脸。
NOTE_MITE_HEAVY,"Pharloom&#8217;s structures seem almost built for them. The endless corners and cracks, so perfect for mites to burrow and nest.",伪造的结构似乎几乎是为它们建造的。无尽的角落和裂缝，非常适合螨虫挖洞和筑巢。
DESC_CRYSTAL_DRIFTER,Flighted creature formed from coldshard. If shattered it will quickly reform.,由Coldshard形成的飞行生物。如果破碎，它将迅速改革。
NOTE_BONE_GOOMBA,"In every land, creatures find new and surprising ways to disguise themselves. One must be wary always.",在每一个土地上，生物都找到了新的和令人惊讶的方法来掩饰自己。必须总是保持警惕。
DESC_BONE_CIRCLER_VICIOUS,"Aggressive winged bug of the lowlands. When angered, it rapidly whips its bladed tail as a weapon.",低地的侵略性翅膀虫。当生气时，它迅速将其刀刃鞭打为武器。
DESC_BONE_HUNTER_CHILD,Young ant hunter wielding sickles carved from teeth. Will often call for aid if danger comes close.,年轻的蚂蚁猎人用牙齿雕刻的镰刀。如果危险接近，通常会要求援助。
DESC_CORAL_BUBBLE_BRUTE,"Overgrown elder, able to spawn burning bubbles from within its coral-cased shell.",长满的长者，能够从其珊瑚壳内部产生燃烧的气泡。
NAME_SONG_ADMINISTRATOR,Minister,部长
DESC_SPLINTER_QUEEN,Imposing old insect nesting in the heights of Shellwood. Her command of twig and branch ensured no pilgrim ever survived within her territory.,在壳牌的高处施加了古老的昆虫筑巢。她对树枝和布兰奇的命令确保没有朝圣者在她的领土内幸存下来。
NOTE_CORAL_BUBBLE_BRUTE,"This bug&#8217;s fusion with the crust-growth... It seems intentional, though I imagine the union is far from comfortable.",这个错误与地壳生长的融合……这似乎是故意的，尽管我认为联盟远远不够舒适。
NOTE_UNDERSTORE_AUTOMATON_EX,Born and built only to work until time stiffens its limbs. Perhaps it is mercy this construct knows nothing of the freedom it lacks.,出生和建造仅是为了工作，直到时间变​​硬。也许这是怜悯这种结构对其缺乏的自由一无所知。
NAME_MOSSBONE_CRAWLER,Mossgrub,mossgrub
NAME_CROW,Craw,嗉
DESC_SHAKRA,Warrior cartographer of a tribe from Pharloom&#8217;s edge. Her skills in battle could challenge the kingdom&#8217;s best.,涉及邮政部落的战士制图师的边缘。她在战斗中的技能可能会挑战王国的最佳状态。
NAME_SONG_AUTOMATON_GOOMBA,Cogwork Crawler,Cogwork爬虫
NOTE_PILGRIM_01_SONG,"Once one of Pharloom&#8217;s favoured bugs, and yet their domain and their shells would have been the first to fall to the Haunting.",曾经有一个伪造的虫子之一，但是他们的域名和炮弹本来是第一个陷入困境的人。
NOTE_CORAL_GOOMBAS,"Hidden amongst their tower&#8217;s matching crust, these smaller bugs would have survived and thrived.",这些较小的虫子藏在其塔中的匹配地壳中，可以生存和蓬勃发展。
NOTE_SPLINTER_QUEEN,This one lived long and fed much. The wood will be much safer for their slaying.,这个人活了很长时间。木头的杀戮将更加安全。
NAME_SWAMP_MOSQUITO_SKINNY,Spit Squit,吐蹲
NOTE_CORAL_SWIMMER_FAT,"They once teemed around their tower, in numbers immense. It is a rare chance to witness such a bountiful display of life.",他们曾经在自己的塔中围绕着巨大的刺激。见证如此丰富的生活的机会是难得的。
NAME_CORAL_BUBBLE_BRUTE,Corrcrust Karaka,Corrcrust Karaka
DESC_BELL_GOOMBA,Burrower that nests in the Bellvein and seeks out hard bells to protects its soft body.,藏在贝尔维因（Bellvein）并寻求坚硬铃铛以保护其柔软身体的武士。
NOTE_CORAL_CONCH_SHOOTER,"It is easy to be caught off-guard by the ricocheting trajectory of its flung mask, especially in tight corners.",它很容易被其扁平面具的弹性轨迹措手不及，尤其是在紧密的角落。
NOTE_PILGRIM_STOMPER_SONG,"Time allowed their shell to grow thick, all the better for battering their targets.",时间使他们的外壳变得浓密，可以更好地打击目标。
NAME_UNDERSTORE_AUTOMATON_EX,Cogwork Hauler,Cogwork Hauler
NAME_FARMER_CATCHER,Dreg Catcher,DREG接球手
DESC_BLADE_SPIDER_HANG,Arachnid that nestles within dark holes in cavern roofs. Pounces on prey from far above.,Arachnid坐落在洞穴屋顶的黑洞中。从远方的猎物上扑来。
NAME_GRASSHOPPER_CHILD,Kindanir,Kindanir
NOTE_GIANT_CENTIPEDE,A monster in the classic form of tales from youth. Its slaying was done as much by my fierce travelling companion as by myself.,一个年轻人的经典故事形式的怪物。我的凶猛旅行伴侣和我自己一样，杀害它的杀戮。
NAME_GNAT_GIANT,Mitemother,Mitemother
NOTE_CORAL_CONCH_STABBER,Passively waits for prey to blunder into its path. A technique that should not necessarily be derided. Whatever is effective is best.,被动地等待猎物进入其道路。不一定要嘲笑的技术。有效的一切都是最好的。
NOTE_LIFEBLOOD_FLY,"My unique shell can resist the darker deformations of this substance, but even I have limits...",我独特的外壳可以抵抗这种物质的深色变形，但即使我也有限制...
DESC_CROWMAN_JUROR_TINY,Screeching scavenger dyed black in mourning at their land&#8217;s collapse.,尖叫的清道夫在他们的土地上哀悼中染上了黑色。
NAME_WHITE_PALACE_FLY,Wingmould,Wingmould
NOTE_GLOOM_BEAST,"Amazingly, the creature carries the void&#8217;s black liquid in its stomach, violently spraying it forth if threatened.",令人惊讶的是，该生物在其胃中携带了黑色液体，如果受到威胁，将其猛烈地喷洒。
NOTE_POKE_SWIMMER,A critical member of the larger flock. Without them present the Kai would be fast driven to extinction by larger predators.,较大羊群的关键成员。没有它们，KAI将被较大的掠食者快速驱动。
DESC_ROSARY_PILGRIM,Strong bug replete with rosaries. If angered they will whip their strings in a ceaseless onslaught.,强烈的虫子充满了念珠。如果激怒了，他们将在不断的猛烈攻击中鞭打弦。
NOTE_SWAMP_MOSQUITO_SKINNY,To subsist on the sickly water in this fetid environment it spits out the most toxic elements. Over generations this former survival technique has turned into an effective hunting tool.,为了在这个臭名昭著的环境中存放在生病的水上，它吐出了最有毒的元素。几代人以前的生存技术已成为一种有效的狩猎工具。
NAME_UNDERSTORE_HEAVY,Undercrank,曲柄
NAME_UNDERSTORE_MITE_GIANT,Giant Drapemite,巨大的Dapemite
NAME_PILGRIM_04_SONG,Choir Flyer,合唱传单
NOTE_CROWMAN,Far more hostile than their younger companions but seemingly less likely to roam far from their nest.,比他们的年轻同伴更具敌意，但似乎远离巢穴的可能性较小。
NAME_PILGRIM_02_SONG,Choir Hornhead,合唱团角
DESC_TORMENTED_TROBBIO,"Depressed thespian, consumed by the melancholy of a collapsing world.",沮丧的thespian，因崩溃世界的忧郁而消耗。
DESC_ROACHKEEPER_CHEF,"Once exulted chef, exiled from the Citadel for repeated culinary crimes.",一旦狂喜，厨师就从城堡中流放，以重复烹饪犯罪。
DESC_UNDERSTORE_SMALL,Feeble servant of the Underworks with a long twistpin and hard shell.,劳动的虚弱的仆人，带有长长的扭动和硬壳。
DESC_SLAB_FLY_MID,"Starved servant of the Slab, bearing a hooked longpin.",平板的饥饿仆人，带有一个钩住的长键。
NAME_SWAMP_DRIFTER,Mothleaf Lagnia,黑叶lagnia
DESC_SONG_AUTOMATON_FLY_SPIKE,"Spherical, winged automaton housing many sharp spikes.",球形，有翼的自动机载有许多锋利的尖峰。
NOTE_BONE_CIRCLER,"Their plump, round shape makes them well-suited for target practice. Difficult to resist testing my aim on them...",他们丰满的圆形使它们非常适合目标实践。难以抗拒测试我对他们的目标...
DESC_CITADEL_BAT_LARGE,Elder Drapefly grown big from age and consumption. Its heavy body allows it to hit much harder than its younger companions.,长老drapefly从年龄和消费中生长出来。它的沉重身体使其比年轻的同伴更难击中。
NAME_GRASSHOPPER_SLASHER,Verdanir,维达尼尔
DESC_LAST_JUDGE,"Final arbiter of the Blasted Steps, tasked to ensure only the sinless ever step beyond the Grand Gate.",爆炸台阶的最后仲裁者，其任务是确保只有无罪的人就超越了大门。
NOTE_TORMENTED_TROBBIO,This one chose to embrace the doom to come. I shall not share such easy surrender.,这个人选择拥抱厄运。我不会分享这么容易的投降。
NAME_GIANT_CENTIPEDE,Bell Eater,贝尔食者
DESC_PEAKS_DRIFTER,Gentle glider of Mount Fay. Its downy wings and cowl allow it to resist even the most cutting cold.,温柔的滑翔机山。它的翅膀和蛋白质柔软的翅膀使其能够抵抗最冷的速度。
DESC_CORAL_BRAWLER,"Heavy, hard-shelled charger relying on weight and strength.",重型，坚硬的充电器依赖重量和力量。
NOTE_FIRST_WEAVER,"This one&#8217;s husk held a masterful talent, to weave Silk into blazing runes. Throughout my life, I have seen runes woven for many tasks. Was she the first to hone such skills?",这个果壳拥有精湛的才华，将丝绸编织成炽烈的符文。在我的一生中，我看到符文编织了许多任务。她是第一个磨练这种技能的人吗？
NAME_PHANTOM,Phantom,幻影
NOTE_GLOOMFLY,This one disturbs me... There is something in its simplicity. Do I almost feel fear?,这个人打扰了我...它的简单性。我几乎感到恐惧吗？
NAME_SONG_HEAVY_SENTRY,Choir Clapper,合唱团拍手
NAME_CROWMAN_DAGGER_JUROR,Squatcraw Juror,Squatcraw陪审员
NOTE_CLOVERSTAG_WHITE,Myth made real in memory. The creature seemed completely at one with the flora around it. Did it ever truly exist as I have seen it?,神话在记忆中真实。这个生物似乎完全是一个植物群。它确实像我所看到的那样真正存在吗？
NOTE_GRASS_GOOMBA,Simple. Graceful. Another fine bug lost forever from these lands.,简单的。优美。这些土地永远失去了另一个好虫子。
NAME_SKULL_KING,Skull Tyrant,头骨暴君
NOTE_TROBBIO,"His desire to see Pharloom saved may have been well intentioned, but he seemed quite happy for others to die upon the stage in pursuit of his goal.",他渴望看到拯救的涉及滑坡的愿望可能是有充分意图的，但是他似乎很高兴其他人在追求自己的目标上死在舞台上。
NAME_CENTIPEDE_TRAP,Garpid,加方
DESC_DOCK_BOMBER,Brave worker carrying unstable flintflame and wearing a heavy bell to protect against potential ignition.,勇敢的工人携带不稳定的火焰弹，并戴着沉重的铃铛来防止潜在的点火。
NOTE_ROCK_ROLLER,"Its bright gems could be used to make beautiful, but short-lived jewellery. An amusing idea for a gift... or a trap.",它的明亮宝石可以用来制作美丽但短暂的珠宝。礼物或陷阱的有趣想法。
DESC_BONE_HUNTER_TINY,"Small burrowing ant, servant to the larger Skarr.",小挖洞的蚂蚁，较大的Skarr的仆人。
DESC_SLAB_FLY_LARGE,"Heavy, hairy jailer responsible for capturing sinners, and punishing prisoners.",沉重，毛茸茸的狱卒负责俘虏罪人和惩罚囚犯。
DESC_MOSSBONE_FLY,Small fluttering creature capable of defending itself with its small stinger.,小型扑动的生物，能够用小毒刺捍卫自己。
DESC_PILGRIM_01,"Agile bug of Pharloom, its higher functions have been lost to the Haunting.",拟南芥的敏捷虫子，其较高的功能已经失去了困扰。
NAME_SONG_AUTOMATON_02,Cogwork Cleanser,COGWORK清洁剂
DESC_CORAL_WARRIOR_GREY,"Old warrior guarding the border of their domain, stiffened by time and awoken by song.",守卫自己域边界的老战士，随着时间的流逝而僵硬，并被歌曲唤醒。
NOTE_SWAMP_MOSQUITO,More dangerous in the moment of its explosive and corrosive death than it ever was in life.,在其爆炸性和腐蚀性死亡的那一刻，比以往任何时候都更加危险。
NOTE_CORAL_WARRIOR,"The core member of a powerful order, trained fearless and faithful. Theirs was a kingdom of warriors, one built upon their blades.",强大的秩序的核心成员，训练有素，无所畏惧和忠实。他们的王国是战士的王国，建在刀片上。
NAME_SCHOLAR,Vaultkeeper,保管员
NAME_SONG_REED_GRAND,Grand Reed,大里德
NOTE_SHELLWOOD_GNAT,"If the woody hide is shattered, the bug will still bravely, foolishly try to attack.",如果木质皮被破碎，那么这个虫子仍然会勇敢，愚蠢地尝试攻击。
DESC_SONG_SCHOLAR_ACOLYTE,"Young acolyte raised in the darkest vaults, destined to ascend to the rank of Scrollreader.",年轻的侍从在最黑暗的穹顶中抬起，注定要登上卷轴的等级。
NAME_LILYPAD_TRAP,Nuphar,nuphar
DESC_ARBORIUM_KEEPER,Learned disciple of the Choir charged to maintain the Citadel&#8217;s Memorium.,合唱团的训练有素的门徒被指控维持城堡＃8217;的纪念活动。
NOTE_SILK_BOSS,"Heart of the Haunting, long lulled to slumber and desperate to wake. The higher being&#8217;s threads stretched throughout Pharloom, snaring its bugs and driving them to madness and discord.",困扰的心脏，长期以来一直沉迷于沉睡，迫切希望醒来。较高的螺纹遍布整个阶层，刺入了虫子，并将其驱赶到疯狂和不和谐。
DESC_GARMOND_ZAZA,"Vigorous old knight and their noble companion, working together to see their lands cut free from haunted madness.",充满活力的老骑士和他们的贵族同伴，共同努力，看到他们的土地摆脱了闹鬼的疯狂。
DESC_ASPID_COLLECTOR,Winged insect that feeds upon moss and lichen in the caves above Bone Bottom.,有翅昆虫以骨底部上方的山洞中的苔藓和地衣为食。
NAME_DOCK_GUARD_THROWER,Forebrothers Signis &amp; Gron,前伯勒斯签名＆amp;格朗
NAME_HUNTER_QUEEN,Skarrsinger Karmelita,Skarrsinger Karmelita
DESC_PHANTOM,Mournful creature tasked alone to expel the Citadel&#8217;s choking refuse. Their talent with a longpin is unmatched.,哀悼的生物独自一人要驱逐城堡的垃圾。他们用长篮的才华是无与伦比的。
NOTE_BONE_WORM,They ceaselessly churn through rock and bone without ever seeming to rest. Do they have a destination? Or are they compelled to dig forever deeper?,他们不断地在岩石和骨头上搅动，似乎从来没有休息过。他们有目的地吗？还是他们被迫永远深入挖掘？
DESC_BLOAT_ROACH,"Obese offshoot of Muckroaches, born of the Citadel&#8217;s exhaust smog. The winged roach&#8217;s sagging stomach is filled with sizzling bile.",肥胖的Muckleaches分支，属于Citadel＆＃8217的排气烟雾。有翼的蟑螂下垂的肚子里充满了嘶嘶作响的胆汁。
NAME_BONE_THUMPER,Marrowmaw,骨髓
DESC_FIRST_WEAVER,Ancient Weaver condemned for a transgression lost to time.,古老的织布工被判处犯罪失去了。
NOTE_CORAL_CONCH_SHOOTER_HEAVY,A fine shot with its sharp mask. Its aggression has no ill effect on its aim.,用锋利的面具进行了精美的镜头。它的侵略对其目标没有不良影响。
NAME_UNDERSTORE_POKER,Underpoke,底盘
NOTE_SPIKE_SWIMMER,"Seeming soft, but hiding a sharp surprise. Any larger predator attempting a bite would learn a pointed and painful lesson.",看起来柔软，但隐藏了一个急剧的惊喜。任何尝试咬人的较大捕食者都会学到一个尖锐而痛苦的教训。
NOTE_WRAITH,Not a bug but a projection of another&#8217;s will cast in smog and Silk.,不是一个错误，而是另一个＆＃8217的投影，将用烟雾和丝绸投射。
NAME_SWAMP_MOSQUITO,Swamp Squit,沼泽蹲
DESC_WEAVER_SERVITOR_LARGE,"Broken construct built by Weavers past, able to fire a focused beam of silklight to carve halls and chambers through ice and bone.",由织布工制成的破碎结构，能够通过冰和骨头发射一束聚焦的丝绸光束，以雕刻大厅和腔室。
NAME_DOCK_CHARGER,Deep Diver,深度潜水员
DESC_WISP,Short-lived sprite born of flickering flame.,短暂的雪碧出生于闪烁的火焰。
DESC_SPIKE_LAZY_FLYER,"Slow drifting bug with a heavy top shell. The bug reacts little to threats, even those that could claim its life.",用沉重的顶壳缓慢漂流。该问题对威胁的反应几乎没有反应，即使是那些可以夺取生命的人。
DESC_DOCK_CHARGER,"Bell-clad bug responsible for mining the deeper, treacherous depths below their docks.",贝尔包装的虫子负责在其码头下方开采更深的，危险的深度。
DESC_SWAMP_BARNACLE,Toothy growth that lives on cave roofs. Wraps wayward bugs with its long tongue and drags them up to be consumed.,生活在洞穴屋顶上的露齿生长。用长的舌头将任性的虫子包裹起来，并将其拖到被消耗掉。
DESC_LILYPAD_FLY,Fine winged flyer that survives in flocks.,精美的有翼传单，可在羊群中生存。
DESC_GIANT_CENTIPEDE,"Long dormant centipede, awoken and enraged by Pharloom&#8217;s crumbling collapse.",长期休眠的cent，伪造的崩溃，醒来和激怒了。
NAME_SHAKRA,Shakra,沙克拉
DESC_CITADEL_BAT,"Erratic, flying pest that nests in rags and curtains.",不稳定的害虫，筑巢在破布和窗帘中。
NAME_SLAB_FLY_SMALL,Scabfly,scabfly
NOTE_PILGRIM_FISHER,"Once a hunter purely for food, now they hunt unthinking and unending.",曾经是纯粹是食物的猎人，现在他们狩猎了不思想和无休止的。
NOTE_LILYPAD_FLY,So light they can rest atop still water&#8217;s surface. An elegant bug indeed.,因此，光线可以停止静水水面。确实是一个优雅的虫子。
NAME_FARMER_CENTIPEDE,Thread Raker,线射手
NOTE_BLOAT_ROACH,Its form is absurd... Surely it should not be able to hold itself in the air? The noxious gases in its stomach must provide its levity.,它的形式是荒谬的...当然，它应该无法在空中保持自己的状态吗？胃中的有害气体必须提供其浮躁。
NOTE_SHELL_FOSSIL_MIMIC,"Once roused, the bug will crash its steely shell into walls, floors and foes.",一旦大声疾呼，该错误将把其钢壳部撞到墙壁，地板和敌人中。
NAME_BONE_HOPPER_GIANT,Hardbone Elder,硬骨长者
DESC_CROWMAN_JUROR,Elder crawbug serving in a sacred ceremony.,Crawbug长老在神圣的仪式上服役。
NAME_SONG_PILGRIM_01,Envoy,使者
NAME_ROSARY_PILGRIM,Covetous Pilgrim,令人垂涎的朝圣者
DESC_PILGRIM_01_SONG,"Agile bug, and one of few hardy pilgrims to have reached the Citadel.",敏捷的虫子，也是少数顽强的朝圣者之一。
NOTE_SONG_PILGRIM_03,"Their use of a pin shows hard training. Their use of Silk, unfurled from a spool held close, shows skill far beyond standard bugs.",他们使用销钉显示出艰苦的训练。他们对丝绸的使用，从封闭的线轴上解开，表明技能远远超出了标准错误。
DESC_CORAL_JUDGE,"Gilded guardian of the Blasted Steps, bearing a cymbal and mallet.",镀金的守护者，带有c脚和槌槌。
DESC_SWAMP_DRIFTER,"A rare, calmer bug of Bilewater, survives its hazardous surroundings by hiding as a plant.",一个稀有的胆汁虫子，通过藏着植物来幸免于其危险的环境。
DESC_SONG_AUTOMATON_01,"Bug forged of iron, rotor and cog. The automaton works tirelessly to maintain the Core that houses it.",锻造铁，转子和齿轮的错误。自动机孜孜不倦地维护容纳它的核心。
DESC_DUSTROACH,"Starved pack bug with an insatiable appetite. Despite their tough hide and pungent meat, roaches breed rapidly so are sometimes farmed for food.",饥饿的包装错误，胃口不满。尽管它们坚硬地皮和刺激性的肉，但蟑螂迅速繁殖，因此有时会耕种食物。
NOTIFICATION_FULL,Journal Updated,日记已更新
NAME_ABYSS_CRAWLER,Shadow Creeper,影子爬行者
NOTE_MAGGOTS,"They cling fast to the shells of other bugs, destroying any hope for concentration or comfort.",他们迅速粘贴在其他虫子的外壳上，破坏了对集中或舒适的希望。
DESC_SHELLWOOD_WASP,"Pointed, darting insect that builds a hardy hive from Shellwood&#8217;s dried bark.",尖头，飞镖昆虫，从壳牌干燥的树皮中建立了耐寒的蜂巢。
DESC_UNDERSTORE_MITE_GIANT,Full-sized mite of the Citadel cloaked in an old curtain.,全尺寸的螨虫，笼罩着一个旧窗帘。
NAME_CRYPT_WORM,Gromling,gromling
NAME_BONE_WORM_BLUETURRET,Plasmidas,质体
NOTE_LILYPAD_TRAP,"A snapping surprise on first encounter, though one easily avoided once aware.",第一次相遇时的惊喜，尽管一旦意识到就很容易避免。
NAME_MITE_HEAVY,Drapemite,Dapemite
NAME_BONE_HUNTER_TINY,Skarrlid,Skarrlid
NOTE_BONE_HUNTER_TRAPPER,"His tracks and traps... It should have been obvious from the start, this old hunter sought to draw me in. But what reason drove him to test himself so brutally? That answer I suspect I shall never know.",他的曲目和陷阱...从一开始就应该很明显，这个老猎人试图吸引我。但是，什么原因驱使他如此残酷地测试自己呢？我怀疑我永远不会知道的答案。
DESC_ROACHKEEPER_CHEF_TINY,Brutish cook responsible for dicing Muckroach meat into edible portions.,野蛮的厨师负责将肉食折磨成可食用的部分。
