Key,EN,ZH
DESC_SONG_AUTOMATON_FLY,"Flighted automaton, responsible for repairing and extending the Core.",飞行的自动机，负责维修和扩展核心。
DESC_BONE_THUMPER,Giant roller of the lowlands. Its ridged hide will crush smaller creatures beneath it.,低地的巨型辊。它的山坡皮将粉碎在其下面的较小生物。
DESC_SONG_THREADED_HUSK_SPIN,"Shell of a small bug possessed by Silk dregs. The husk will stretch its Silk to form a crude, crushing wheel.",丝绸dreg拥有的小虫​​子的外壳。果壳会伸展丝绸，形成一个粗糙的碎轮。
DESC_CROWMAN,Rag-winged adult crawbug bearing a scavenged pin.,抹布的成年cra虫带有清除的销钉。
NAME_DUSTROACH,Muckroach,糟糕
NOTE_SONG_AUTOMATON_BALL,"I have not yet seen the bell this automaton is designed to ring, nor do I ever wish to hear it. Such a clamour would no doubt be unpleasant to experience.",我还没有看到这种自动机旨在响起的铃铛，也从未想过听到它。毫无疑问，这样的喧嚣会令人不愉快。
NAME_CLOVERSTAG_WHITE,Palestag,palestag
NOTE_CORAL_JUDGE_CHILD,"If allowed the opportunity, these creatures will grow into a form larger and more oppressive.",如果允许机会，这些生物将成长为更大，更压迫的形式。
NOTE_SETH,"He offered fair warning and challenge, a duel in the purest sense. I admire his honour, and his skill.",他提供了公平的警告和挑战，这是最纯粹的决斗。我钦佩他的荣誉和他的技巧。
DESC_STICK_INSECT_CHARGER,"Insect formed to imitate a branch, born with sharp, retractable horns atop its head.",形成的昆虫是为了模仿一个树枝，其头顶上有尖锐的可伸缩角。
DESC_BONE_GOOMBA,"Small, soft bug that uses the hard skulls of the Marrow for protection and disguise.",小而柔软的虫子，使用骨髓的硬头骨进行保护和伪装。
NOTE_FIELDS_FLYER,"When roosting, it would look convincingly plant like. In flight, its bulbous body quickly ruins the ruse.",栖息时，它看起来像是令人信服的植物。在飞行中，它的球茎身体迅速破坏了诡计。
NAME_CORAL_FLYER_THROW,Yago,Yago
NAME_FIELDS_FLYER,Flapping Fertid,拍打
DESC_MITE_HEAVY,Cloth-covered crawler with sharpened forelimbs. Lives and breeds in dark places.,用布覆盖的爬虫带有锐利的前肢。在黑暗的地方生活和繁殖。
NAME_BELL_FLY,Winged Furm,有翼公司
NOTE_UNDERSTORE_THROWER,The cost of so much grandeur... Did I peer closely enough into the foundations of my own kingdom?,这么多宏伟的成本...我是否非常紧密地凝视着自己的王国的基础？
DESC_CROWMAN_DAGGER,Stout adult crawbug bearing several short pins.,粗壮的成人crawbug带有几个短销。
NAME_TAR_SLUG,Lavalug,拉瓦格
NOTE_CITADEL_BAT_LARGE,Greed will always see some bugs swell above their kin.,贪婪总是会看到一些虫子在他们的亲戚上方膨胀。
NOTE_HUNTER_QUEEN,"This graceful ruler once possessed skill to rival my own. At her youthful peak, her voice united all Skarr in her service.",这个优雅的统治者曾经拥有与我自己的竞争技巧。在她年轻的高峰期，她的声音团结了她的服务。
DESC_WHITE_PALACE_FLY,False fly with a rune etched shell. A tortured mix of soul and void is caged within.,带有符文蚀刻壳的假苍蝇。笼罩着灵魂和空白的折磨的混合物。
DESC_SWAMP_DUCTSUCKER,Suction creature surviving on the thick slime that coats its caves.,吸力生物在覆盖其洞穴的厚粘液上存活。
DESC_ROACHFEEDER_TALL,Tall roach tender charged to feed Muckroaches on a lean diet of maggot gruel.,高大的蟑螂招标费用，以淡淡的麦角饮食饮食喂食。
DESC_SHELLWOOD_GNAT,"Tiny, soft creature that armours itself using the hard, hollow growths of Shellwood.",shellwood的坚硬而空心的生长，柔软的生物很小，柔软的生物。
NOTE_PILGRIM_03,"Taken by Pharloom&#8217;s Haunting, the bug is now capable of little more than prayer and aggression.",该虫子被伪造的虫子带走了，现在的虫子不仅仅能够祈祷和侵略。
NAME_PILGRIM_03,Pilgrim Groveller,朝圣者格罗维勒
DESC_GIANT_FLEA,"Oversized bug, briefly consumed by anger after its long time caged.",超大的虫子长时间被愤怒笼罩了。
NOTE_ARBORIUM_KEEPER,"From the outset, theirs was a hopeless task. Those wild lands could never be replicated within a space so artificial.",从一开始，他们的工作是一项绝望的任务。这些野生土地永远不会在如此人造的空间内复制。
DESC_SPINE_FLOATER,Spine-shooting drifter of the lowlands.,低地的脊柱射门漂流者。
DESC_CORAL_JUDGE_CHILD,Wriggling young grub that lives in darkness.,蠕动的年轻grub生活在黑暗中。
NOTE_SONG_PILGRIM_02,"Their procedures with Silk may have prolonged life within the Citadel, but they unknowingly gifted many minds to the monarch.",他们用丝绸的程序可能延长了城堡内的寿命，但他们在不知不觉中向君主献了许多思想。
DESC_BLOOM_SHOOTER,Floral foe that reacts instinctively to movement nearby. Spits pellets of crackling pollen that burst on impact.,花卉敌人本能地对附近的运动做出反应。吐出的脆皮花粉会破坏撞击。
NAME_SLAB_PRISONER_LEAPER_NEW,Penitent,it悔
NAME_FIELDS_GOOMBA,Fertid,肥料
NAME_SHELLWOOD_GNAT,Shellwood Gnat,Shellwood GNAT
NAME_SONG_KNIGHT,Second Sentinel,第二个哨兵
NOTE_CORAL_HUNTER,"In contests of speed against strength, I have seen the swift more often triumphant, a lesson I have taken to my own heart.",在反对力量的速度比赛中，我看到迅速的经常胜利，这是我自己心中的一堂课。
NAME_UNDERSTORE_THROWER,Underloft,Underloft
NAME_PILGRIM_FISHER,Pondcatcher,Pondcatcher
NAME_STICK_INSECT,Splinter,碎片
DESC_PILGRIM_BELLTHROWER_FLY,"Pilgrim endowed with large wings, carrying a brace of iron bells.",朝圣者拥有大翅膀，拿着一把铁铃。
NAME_BONE_HUNTER_FLY,Spear Skarr,长矛斯卡尔
NOTE_BONE_HUNTER_FLY,"In my youth, I envied all bugs with wings. I even fancied I might grow a pair... I have since learned better. Accept the limitations of one&#8217;s body... and augment with tools as needed.",在我的青年时代，我羡慕所有翅膀的虫子。我什至幻想我可能会成长一对...从那以后我学到了更好的学业。接受One＆＃8217的身体...并根据需要使用工具增强的局限性。
DESC_SHELL_FOSSIL_MIMIC,Devious ambusher that poses as a fossil.,伪装成化石的狡猾伏击者。
NAME_WRAITH,Wraith,幽灵
NOTE_SONG_REED_GRAND,"This bug bears a spool of Silk, which they flail to attack. Though somewhat crude, theirs is a technique much reminiscent of Weavers. I wonder who taught them such a use?",该虫带有一根丝线，它们会弹攻击。尽管有些粗糙，但它们的技术使人联想起织布工。我想知道谁教他们这样的用途？
NOTE_FLOWER_QUEEN,"Her presence would once have maintained the wood&#8217;s fragile order, allowing the safe passage of bugs across its branches.",她的存在曾经曾经保持木材的脆弱秩序，从而使虫子安全地穿过其树枝。
NAME_PILGRIM_MOSS_SPITTER,Overgrown Pilgrim,朝圣的朝圣者
NOTE_HORNET_DRAGONFLY,"Though generally passive, their sharp masks can cause injury if carelessly blundered into.",尽管通常是被动的，但如果不小心犯错，他们的尖锐面具会造成伤害。
NAME_MITEFLY,Fluttermite,Fluttermite
NOTE_PINSTRESS_BOSS,"I like her. For her willingness to teach and her spirit still strong, despite a long age spent solitary... she has my respect.",我喜欢她。尽管长期孤独地花了很长时间，但她愿意教书和精神仍然很强……她得到了我的尊重。
NAME_STICK_INSECT_FLYER,Splinterbark,碎片
NOTE_CORAL_WARRIOR_GREY,"They held long at their vigil, far beyond the age of their brethren, yet still when roused they swung their blade with remarkable ease.",他们在守夜活动中长期以来一直远远超出了弟兄的年龄，但是当他们醒来时，他们仍然轻松地挥舞着刀片。
DESC_RHINO,"Long-horned beast of Pharloom&#8217;s lowlands. Relies on its horn both to impale and to wrench the ground beneath it, flinging dangerous debris.",贫民窟的长角野兽的低地。依靠它的喇叭来凸出并拧下它下面的地面，挥舞着危险的碎屑。
NOTE_ROACHKEEPER_CHEF_TINY,"Could their actions be called skill? I see only a crude mangling of meat. Yet I wonder, before the Haunting snared their minds was it any different?",他们的行动可以称为技能吗？我只看到一块粗糙的肉。但是，我想知道，在困扰着他们的想法之前，有什么不同吗？
DESC_GRASSHOPPER_SLASHER,Darting warrior with sharpened forelimbs and heightened senses.,飞镖战士的前肢尖锐并增强了感官。
DESC_SONG_HEAVY_SENTRY,"Mighty percussive disciple of the Choir, wielding a mallet and a Silk spool to wrap and enhance their attacks.",合唱团的强大打击乐门徒，挥舞着槌和丝线线轴，以包裹和增强其攻击。
DESC_CLOVER_DANCER,"Dual princes of old Verdania, beloved by their subjects for their grace and for the ballet of death they delivered upon outsiders.",旧弗丹尼亚的双王子，因其恩典而受到臣民的喜爱，以及他们为局外人带来的死亡芭蕾舞。
NOTE_BELL_FLY,"Huge and soft, a fantastic combination ruined by their haunted aggression.",巨大而柔软的，一种奇妙的组合，因其鬼屋的侵略而破坏。
NAME_BONE_HOPPER,Hardbone Hopper,硬骨料斗
NOTE_PILGRIM_BELLTHROWER_FLY,On uneven terrain their union of flight and range can prove a challenge even for me.,在不平坦的地形上，他们的飞行和射程结合也可能对我构成挑战。
NOTE_UNDERSTORE_POKER,"They toiled incessantly for the Citadel, their shells bent and greyed, and now the kingdom&#8217;s curse means not even death can relieve them.",他们不停地为城堡辛苦劳作，贝壳弯曲并灰色，现在王国的诅咒意味着甚至没有死亡可以缓解他们。
NOTE_SHELLWOOD_WASP,"Destroying the hives will limit their presence in the wood. Useful to me now, as I pass along the branches. Dangerous in time for the wood&#8217;s order. Even a small disruption can tip a fragile balance.",破坏蜂箱将限制他们在木头中的存在。现在，当我沿着分支机构时，对我有用。木材订单的及时危险。即使是微小的破坏也会使平衡脆弱。
NOTE_SONG_AUTOMATON_SHIELD,"It has no true mind, and yet fights effectively, adjusting its strategy to my movements. Where exactly are its thoughts written?",它没有真正的思想，但有效地战斗，将其策略调整为我的运动。它的想法到底在哪里？
NOTE_LACE,"A bug born entirely of thread. Much Silk would have been needed to see her sustained. A fragile form of life, but life nonetheless.",一个完全由线程诞生的错误。要看到她的持久需要很多丝绸。生活的一种脆弱的形式，但生活仍然如此。
NAME_SWAMP_SHAMAN,Groal the Great,巨大的
NOTE_MITE,"Individually they offer little challenge, but their numbers are surely vast and most remain hidden.",他们单独提供的挑战几乎没有挑战，但是他们的数字肯定是庞大的，大多数人仍然隐藏。
NOTE_PILGRIM_05,A lucky bug to be able to grow old. Pharloom&#8217;s roads take most much earlier.,一个幸运的虫子，可以长大。伪造的道路最早的道路。
DESC_CRYSTAL_DRIFTER_GIANT,Huge flighted creature formed from coldshard.,由Coldshard形成的巨大飞行生物。
NOTE_SHAKRA,"She has lived a mere fraction of my lifetime and yet her rings prove a ferocious match. As gifted a warrior as I have ever encountered, and one I am fortunate to call a friend.",她的一生中只有一小部分，但她的戒指证明了一场凶猛的比赛。就像我遇到的那样有天赋的战士，我很幸运能打电话给朋友。
NOTE_BONE_THUMPER,"Sheer bulk makes for an effective weapon, but requires much sustenance. This creature would have spent most of its time eating. An acceptable life for some.",纯粹的体积可以提供有效的武器，但需要太多的寄托。这个生物大部分时间都在吃饭。某些人可以接受的生活。
NOTE_ABYSS_CRAWLER_LARGE,"These ones grow large, yet I have never observed them eating, or sleeping. They seem such simple bugs... but I suspect they are not truly our cousins.",这些生长大，但我从未观察到他们在吃东西或睡觉。他们似乎很简单...但是我怀疑它们不是我们的堂兄。
DESC_BONE_BEAST,"Huge, hardbone bug that lives within and travels through the veins of old bells across Pharloom.",巨大的硬骨虫子生活在内部，并穿过旧铃铛的静脉。
DESC_PILGRIM_03_SONG,"Winged devout of the Citadel, carrying a brace of gilded bells.",城堡有翼的虔诚，带有镀金的铃铛。
NOTE_PEAKS_DRIFTER,"This one would make a perfect pet, but for the freezing temperatures it requires for comfort.",这将成为一只完美的宠物，但对于舒适的冻结温度。
NOTE_DUSTROACH_POLLYWOG,"These creatures look to have been bred deliberately in watery pens. If they are food to be, their scent suggests they must taste vile.",这些生物看起来是故意用水笔饲养的。如果它们是食物，他们的气味表明他们必须味道卑鄙。
NOTE_BONE_HUNTER_CHIEF,"Their skill once saw them chosen, and I can plainly see why. They would have lived and trained only for this duty.",他们的技能曾经看到他们选择，我可以清楚地看到原因。他们本来只为这项职责而生活和培训。
NOTE_PILGRIM_04_SONG,For this bug to have survived Pharloom&#8217;s climb it must have teamed with stouter companions. I cannot imagine it succeeding alone.,为了使这个错误幸存下来，在涉及阶梯式的攀爬中必须与Stouter伴侣合作。我无法想象它一个人成功。
NOTE_PILGRIM_02_SONG,"Did this one grow large thanks to the Citadel&#8217;s excess, or was its formidable size the reason it ever survived to reach this place?",这要归功于Citadel的过量，还是它的强大尺寸是它幸存下来的原因？
NOTE_SKULL_KING,"Though surely fierce, the skull it bears looks taken from an even larger beast. If not for the bones as proof, I would scarcely believe bugs could grow to such scale.",尽管肯定是凶猛的，但它带有的头骨看起来像更大的野兽。如果不是为了证明骨头，我几乎不会相信虫子可以成长为这样的规模。
NAME_BLADE_SPIDER,Pharlid,小卷
NAME_FARMER_SCISSORS,Silk Snipper,真丝狙击手
NAME_SONG_AUTOMATON_BALL,Cogwork Clapper,COGWORK拍手
NOTE_CLOCKWORK_DANCER,"Two cogwork bugs, and yet the soul seemed singular? A sad, yet masterful imitation of life, imbued inside shells of iron.",两个cogwork虫子，但是灵魂似乎很奇怪吗？对生命的悲伤但精湛的模仿，充满了铁的壳。
NAME_BONE_WORM_BLUEBLOOD,Plasmid,质粒
DESC_DRAGONFLY_LARGE,Heavy insect that lives near large bodies of water. Its weighty body is best avoided.,沉重的昆虫，生活在大物体附近。最好避免它的体重。
NAME_BONE_CRAWLER,Kilik,基里克
DESC_FLOWER_DRIFTER,Drifting bug disguised as a flower. Disperses crackling clouds of pollen if threatened.,伪装成花朵的虫子。如果受到威胁，将分散花粉云。
DESC_BLACK_THREAD_CORE,Dense knot of husks bound tight by void soaked Silk.,果壳的密集结，被无效的浸透丝绸绑住。
NAME_SONG_AUTOMATON_FLY,Cogworker,cogworker
NAME_SONG_THREADED_HUSK_SPIN,Dregwheel,Dregwheel
NOTE_BLADE_SPIDER_HANG,"A smart hunter learns to wait long in ambush, always ready to strike the first blow.",一个聪明的猎人学会了在伏击中等待很长时间，随时准备击中第一击。
DESC_BONE_HOPPER,Grazing creature with sharp senses that nimbly retreats from danger.,带有敏锐的感官放牧生物，从危险中恢复过来。
DESC_FIELDS_FLOCK_FLYERS,"Tiny, timid creatures that huddle in flocks and flee at the first hint of danger.",小小的胆小的生物挤在羊群中，并在第一个危险的暗示中逃跑。
NOTE_DOCK_GUARD_THROWER,"Lost in the madness of the Haunting, they still commanded the endless excavation of their caves.",他们在困扰的疯狂中迷失了，他们仍然指挥着无休止的洞穴发掘。
NAME_CROWMAN_JUROR_TINY,Craw Juror,克劳陪审员
NOTE_GRASSHOPPER_SLASHER,"They rarely relax, always alert for potential danger, even deep in their own territory. To defeat them my focus must match their own.",他们很少放松，总是警告潜在的危险，甚至在自己的领土深处。要击败他们，我的重点必须与自己的重点相匹配。
DESC_SONG_AUTOMATON_02,"Steam shooting automaton, forged to clean the Cogwork Core and keep it free of infestation.",蒸汽射击自动机，伪造以清洁齿轮核心并保持侵扰。
NAME_BONE_BEAST,Bell Beast,贝尔野兽
DESC_SLAB_FLY_SMALL,"Sticky young fly, born and grown in service to the Slab.",粘稠的年轻苍蝇，出生并长大为板。
NAME_HORNET_DRAGONFLY,Pendra,彭德拉
NAME_SHELLWOOD_WASP,Wood Wasp,木黄蜂
NAME_ROSARY_THIEF,Snitchfly,Snitchfly
NOTE_SWAMP_DUCTSUCKER,"This mindless bug seems to sense only through its tendrils, yet despite that simplicity it still poses a serious threat.",这个无知的虫子似乎只通过卷须才能感知，尽管这种简单性仍然构成了严重的威胁。
NAME_ASPID_COLLECTOR,Aknid,knnid
NAME_BONE_GOOMBA_LARGE,Skull Brute,头骨蛮横
DESC_PILGRIM_03,"Basic bug of Pharloom, laid low upon the ground.",滑织的基本虫子，在地面上低落。
NOTE_BONE_CRAWLER,"I am fond of simple, effective traps such as this bug&#8217;s extendable spikes. An unwary predator would be skewered clean through.",我喜欢简单，有效的陷阱，例如此错误的可扩展峰值。一个粗心的捕食者会被清洁。
DESC_PILGRIM_04,Short pilgrim that uses their long horn to launch upon threats.,短朝圣者利用其长号角在威胁下发射。
DESC_PILGRIM_05,Thick-set bug consumed by haunted thread. Uses their solid frame to crush others.,鬼魂线消耗的厚空错误。使用他们的坚实框架粉碎他人。
DESC_MOSSBONE_CRAWLER,Fur covered crawler with a series of sharp spikes along its back.,皮草覆盖的爬虫沿着它的背面有一系列尖锐的尖峰。
DESC_BONE_WORM,Burrowing worm that uses its many blunted teeth to dig through even the hardest bone.,挖洞的蠕虫使用其许多钝牙的牙齿挖掘到最坚硬的骨头。
NOTE_SLAB_FLY_BROODMOTHER,"With this one vanquished, I hope to have sped the end for that jail and its distasteful order.",随着这个人的征服，我希望能为该监狱及其令人反感的命令加快结束。
DESC_CORAL_SWIMMER_SMALL,Gelatinous coral drifter of simple mind and placid demeanour.,简单思维和平静的举止的凝胶状珊瑚漂流者。
DESC_WISP_PYRE_EFFIGY,"Totem and god, built and worshipped by the Burning Bugs.",图腾和上帝，由燃烧的虫子建造和崇拜。
NAME_CORAL_CONCH_SHOOTER,Driznit,德里兹尼特
DESC_FIELDS_GOOMBA,Skittish scrambler of the Far Fields. Its antennae resemble stalks of grass to aid in camouflage.,远处的拼字游戏。它的触角类似于草的茎，以帮助伪装。
DESC_SLAB_FLY_SMALL_FRESH,"Infant fly, freshly hatched. At this age the soft, blind fly is little more than a bother.",婴儿飞，新鲜孵化。在这个时代，柔软的盲蝇不仅仅是困扰。
NAME_CITADEL_BAT,Drapefly,垂垂蝇
DESC_BONE_HOPPER_GIANT,Tall creature with sharp senses. Defends its herd with powerful legs and a sharp tipped mask.,高大的生物具有敏锐的感官。用强有力的腿和尖锐的面具捍卫自己的牛群。
NAME_BONE_CIRCLER_VICIOUS,Vicious Caranid,恶毒的caranid
DESC_SONG_PILGRIM_02,"Cruel physician of Whiteward, responsible for operations and modifications on the Citadel&#8217;s bugs.",怀特沃德（Whiteward）残酷的医生，负责城堡的操作和修改。
NOTE_LAST_JUDGE,"The huge Judge likely stood through countless generations, never defeated, never wavering in their charge.",这位巨大的法官可能站在无数世代，从未被击败过，从未在他们的指控中动摇。
NOTE_FARMER_CATCHER,"These bugs look to have spent every waking moment at their work. Grim, endless labour in service of the unseen Citadel above.",这些虫子看起来已经度过了每一个醒来的时刻。严峻，无休止地为上面看不见的城堡服务。
NAME_SWAMP_GOOMBA,Miremite,米尔米特
NAME_GRASSHOPPER_FLY,Escalion,升华
NAME_FLOWER_DRIFTER,Phacia,Phacia
NOTE_BONE_HOPPER,"Despite the Haunting of its shell, it has not been overcome with aggression. Its desire to flee remains too strong.",尽管壳的困扰，但它并没有被侵略克服。它逃离的愿望仍然太强烈了。
DESC_CORAL_GOOMBA_LARGE,"Coral hulk with a dense shell, bred to immense size by the Citadel&#8217;s Memorium.",珊瑚绿巨人的浓密外壳，由城堡的纪念馆繁殖到巨大的大小。
NAME_BONE_CIRCLER,Caranid,卡拉尼德
NAME_BONE_HUNTER,Skarr Stalker,Skarr Stalker
NAME_PILGRIM_BELL_THROWER,Pilgrim Bellbearer,朝圣者
DESC_PILGRIM_02,Sturdy bug lost to the Haunting. Rolls at threats with no care for its own discomfort.,坚固的虫子因困扰而失去了。不愿意自己的不适而面临威胁。
DESC_GLOOMFLY,"Tiny empty creature, barely a bug. Swallows its prey whole and sucks their nutrients until nothing remains.",微小的空生物，几乎没有一个错误。吞下它的猎物，并吸收营养，直到什么都没有。
NAME_UNDERSTORE_SMALL,Underworker,工作人员
NOTE_FLOWER_DRIFTER,Quite a beautiful creature. In my own kingdom&#8217;s court it would have been highly favoured as an ornamental pet.,一个美丽的生物。在我自己的王国中，这本来可以被视为装饰宠物。
NOTE_BONE_HOPPER_GIANT,"There is surprising strength hidden in their thin, elegant limbs. It would be a pleasure to ride upon it...",他们的薄而优雅的四肢隐藏着令人惊讶的强度。骑它会很高兴...
NOTE_SPINE_FLOATER,Whatever admiration I had for its fleecy down is spoilt by its disturbing mask... and its steely spines.,无论我对羊毛的钦佩是什么都被它令人不安的面具弄坏了……又是钢铁般的刺。
NAME_FARMER_WISP,Burning Bug,燃烧的虫子
DESC_SHIELD_DOCK_WORKER,Cymbal bearing worker of the Deep Docks. Pans the hauls of smokerock to find traces of more precious minerals.,深码头的c轴承工人。pan绕着Sumberock的拖拉，以找到更多珍贵的矿物质的痕迹。
DESC_TAR_SLUG,Sticky mollusc that defends itself by spraying burning fluid from growths on its back.,粘性软体动物通过向背部的生长喷洒燃烧的液体来捍卫自己。
NOTE_SWAMP_DRIFTER,"This one is pretty, but not as soft as first it seems. The plant it mimics is flaked and coarse, and the bug&#8217;s coat shares similar texture.",这个很漂亮，但似乎不如首先柔软。它模仿的植物是片状和粗糙的，而虫子的外套具有相似的质感。
DESC_DOCK_WORKER,"Low level worker lost to Pharloom&#8217;s Haunting. Instinct keeps them at their task, though in much simpler fashion than before.",低水平的工人输给了涉及滑坡。本能使他们遵守他们的任务，尽管以比以前要简单得多。
NOTE_BLADE_SPIDER,"Something in their assault reminds me of my own skill, though their talents are born purely of instinct. My technique is formed from hard training.",尽管他们的才华纯粹是本能的，但他们的袭击中的某些事情使我想起了自己的技能。我的技术是由艰苦训练形成的。
NOTE_RHINO,Certain tools and skills can pierce its defences. I should adjust my strategy as needed.,某些工具和技能可以刺穿其防御能力。我应该根据需要调整策略。
NAME_SILK_BOSS,Grand Mother Silk,大母亲丝绸
NAME_ROACHKEEPER_CHEF,Disgraced Chef Lugoli,可耻的卢戈利厨师
DESC_FARMER_CATCHER,Bug charged to catch dregs of Silk that fall from the Citadel. Will attack with its staff if provoked.,虫子被指控捕获从城堡掉下来的一块丝绸。如果被激怒，将与其员工攻击。
NOTE_MITEFLY,"Similar bugs would gnaw away at unguarded food supplies in my homeland. As a child I would hunt them, eager to make use of myself and test my skills.",类似的虫子会在我家乡的无保护食品供应中gnaw缩。小时候，我会狩猎他们，渴望使用自己并测试自己的技能。
DESC_SONG_AUTOMATON_GOOMBA,"Automaton built in the shape of a scuttling bug. Its back contains retractable pins, intended to cut song cylinders free of any obstruction.",自动机以scut虫的形状建造。它的背部包含可伸缩的销钉，旨在将歌曲缸无障碍物切割。
NAME_SPIKE_SWIMMER,Steelspine Kai,Steelspine Kai
DESC_PILGRIM_STAFF_UNDERSTORE,Uses their steel bristled pin to scrub the soot from vents and pipes.,使用其钢制的销钉从通风孔和管道上擦洗烟灰。
DESC_BONE_HUNTER_TRAPPER,"Huge, yet stealthy Skarr. An expert trapper and master of the undergrowth.",巨大而隐形的Skarr。灌木丛的专家捕手和大师。
DESC_ABYSS_TENDRIL,"Lashing fragments of pure darkness, shaped into sharpened tentacles.",纯净的黑暗碎片，形成尖锐的触角。
NAME_BELL_GOOMBA,Furm,Furm
NAME_CLOCKWORK_DANCER,Cogwork Dancers,Cogwork舞者
DESC_BONE_GOOMBA_LARGE,"Soft bug beneath a huge, horned skull. Charges at intruders to protect its territory and its smaller companions.",在一个巨大的有角头骨下方的软虫。向入侵者指控以保护其领土和较小的同伴。
DESC_BONE_CIRCLER,"Common winged bug of the lowlands. Generally docile, but will attack if threats come close.",低地的普通翼虫。通常温顺，但如果威胁接近，会攻击。
