Key,EN,ZH
DESC_ROACHFEEDER_TALL,Tall roach tender charged to feed Muckroaches on a lean diet of maggot gruel.,负责用蛆虫糊喂养腐汁蟑螂的高瘦饲育者。
DESC_SHELLWOOD_GNAT,"Tiny, soft creature that armours itself using the hard, hollow growths of Shellwood.",用甲木林硬质空茎武装自身的脆弱飞虫。
NOTE_PILGRIM_03,"Taken by Pharloom&#8217;s Haunting, the bug is now capable of little more than prayer and aggression.",丝咒侵蚀了它们的理智，如今这些虫子只剩祷告与攻击的本能。
NAME_PILGRIM_03,Pilgrim Groveller,伏地朝圣者
DESC_GIANT_FLEA,"Oversized bug, briefly consumed by anger after its long time caged.",长期囚禁后暴怒的巨型跳蚤。
NOTE_ARBORIUM_KEEPER,"From the outset, theirs was a hopeless task. Those wild lands could never be replicated within a space so artificial.",从最初这就是徒劳之举——自然的荒野绝无可能在虫子造出的空间刻意复现。
DESC_SPINE_FLOATER,Spine-shooting drifter of the lowlands.,低地地区的游荡者，绒毛下暗藏钢刺并具备远程发射能力。
DESC_CORAL_JUDGE_CHILD,Wriggling young grub that lives in darkness.,在黑暗中蠕动的幼虫。
NOTE_SONG_PILGRIM_02,"Their procedures with Silk may have prolonged life within the Citadel, but they unknowingly gifted many minds to the monarch.",他们的灵丝手术虽维系了圣堡的生命，却无意中将所有心智献予了君主。
DESC_BLOOM_SHOOTER,Floral foe that reacts instinctively to movement nearby. Spits pellets of crackling pollen that burst on impact.,对周围动静极其敏感的植物，能够喷射噼啪作响的花粉弹。
NAME_SLAB_PRISONER_LEAPER_NEW,Penitent,悔罪者
NAME_FIELDS_GOOMBA,Fertid,拟草虫
NAME_SHELLWOOD_GNAT,Shellwood Gnat,甲木蚋虫
NAME_SONG_KNIGHT,Second Sentinel,次席戍卫
NOTE_CORAL_HUNTER,"In contests of speed against strength, I have seen the swift more often triumphant, a lesson I have taken to my own heart.",见证这以快制胜的案例，更坚定了我对敏捷的追求。
NAME_UNDERSTORE_THROWER,Underloft,圣厂投掷者
NAME_PILGRIM_FISHER,Pondcatcher,渔夫
NAME_STICK_INSECT,Splinter,碎裂者
DESC_PILGRIM_BELLTHROWER_FLY,"Pilgrim endowed with large wings, carrying a brace of iron bells.",配备一对铁钟的飞行朝圣者。
NAME_BONE_HUNTER_FLY,Spear Skarr,斯卡尔长矛手
NOTE_BONE_HUNTER_FLY,"In my youth, I envied all bugs with wings. I even fancied I might grow a pair... I have since learned better. Accept the limitations of one&#8217;s body... and augment with tools as needed.",年少时，我曾一度羡慕生来便有翅膀的虫族，甚至曾幻想自己也能长出一对来……如今我已明白，接受身体上的限制，并学会用工具弥补缺陷才是正途。
DESC_SHELL_FOSSIL_MIMIC,Devious ambusher that poses as a fossil.,伪装成化石的狡诈伏击者。
NAME_WRAITH,Wraith,丝魂
NOTE_SONG_REED_GRAND,"This bug bears a spool of Silk, which they flail to attack. Though somewhat crude, theirs is a technique much reminiscent of Weavers. I wonder who taught them such a use?",这只虫子携带着一轴灵丝，并挥舞它进行攻击。动作虽略显粗糙，但竟带着几分织者的神韵。不知是谁教会了它这样使用灵丝？
NOTE_FLOWER_QUEEN,"Her presence would once have maintained the wood&#8217;s fragile order, allowing the safe passage of bugs across its branches.",昔日的她维持领域内脆弱的平衡，护佑虫子们安然通行其枝干。
NAME_PILGRIM_MOSS_SPITTER,Overgrown Pilgrim,苔蚀朝圣者
NOTE_HORNET_DRAGONFLY,"Though generally passive, their sharp masks can cause injury if carelessly blundered into.",虽性情温顺，但若冒失冲撞其锋利面甲仍会受伤。
NAME_MITEFLY,Fluttermite,飞蚀螨
NOTE_PINSTRESS_BOSS,"I like her. For her willingness to teach and her spirit still strong, despite a long age spent solitary... she has my respect.",我欣赏她——甘于传授技艺，孤寂长年也未磨灭斗志，值得尊敬。
NAME_STICK_INSECT_FLYER,Splinterbark,裂皮碎裂者
NOTE_CORAL_WARRIOR_GREY,"They held long at their vigil, far beyond the age of their brethren, yet still when roused they swung their blade with remarkable ease.",他们戍边的年岁就能远超同辈寿命，苏醒时仍能挥动利刃，动作流畅自如。
DESC_RHINO,"Long-horned beast of Pharloom&#8217;s lowlands. Relies on its horn both to impale and to wrench the ground beneath it, flinging dangerous debris.",纺络低地的长角巨兽，依赖长角穿刺敌人并掘起地面制造危险碎片云。
NOTE_ROACHKEEPER_CHEF_TINY,"Could their actions be called skill? I see only a crude mangling of meat. Yet I wonder, before the Haunting snared their minds was it any different?",这般行径怎能称为厨艺？我只见到对血肉的粗暴摧残。它在丝咒侵蚀前，或许不会像现在这样粗鄙行事？
DESC_GRASSHOPPER_SLASHER,Darting warrior with sharpened forelimbs and heightened senses.,前肢尖利且感官强化的迅捷战士。
DESC_SONG_HEAVY_SENTRY,"Mighty percussive disciple of the Choir, wielding a mallet and a Silk spool to wrap and enhance their attacks.",圣咏团的打击乐信徒，挥舞槌棒，并利用灵丝轴强化它们的攻击。
DESC_CLOVER_DANCER,"Dual princes of old Verdania, beloved by their subjects for their grace and for the ballet of death they delivered upon outsiders.",昔日翠庭王国的双生王子，以恩典治国，深受子民爱戴。对于不怀好意的外来者，他们会为其献上一支死亡芭蕾。
NOTE_BELL_FLY,"Huge and soft, a fantastic combination ruined by their haunted aggression.",明明是个蓬松的大毛球，可惜被丝咒搞得见谁都想撞两下。
NAME_BONE_HOPPER,Hardbone Hopper,硬骨跳跃者
NOTE_PILGRIM_BELLTHROWER_FLY,On uneven terrain their union of flight and range can prove a challenge even for me.,崎岖地形中，其飞行阵列的配合连我也需谨慎应对。
NOTE_UNDERSTORE_POKER,"They toiled incessantly for the Citadel, their shells bent and greyed, and now the kingdom&#8217;s curse means not even death can relieve them.",他们为圣堡鞠躬尽瘁直至甲壳弯折灰败，如今连死亡都无法终结这诅咒。
NOTE_SHELLWOOD_WASP,"Destroying the hives will limit their presence in the wood. Useful to me now, as I pass along the branches. Dangerous in time for the wood&#8217;s order. Even a small disruption can tip a fragile balance.",摧毁蜂巢会限制它们在林中的活动。对我而言，这在穿行丛林时十分有用。但从长远来看，即便是微小的干扰，也可能打破丛林脆弱的生态平衡。
NOTE_SONG_AUTOMATON_SHIELD,"It has no true mind, and yet fights effectively, adjusting its strategy to my movements. Where exactly are its thoughts written?",当它用盾牌格挡我的织针突刺，同时以刁钻角度刺出长枪时，我仿佛在与某个沉睡在齿轮中的古老剑客对决。
NOTE_LACE,"A bug born entirely of thread. Much Silk would have been needed to see her sustained. A fragile form of life, but life nonetheless.",完全由灵丝编织而成的虫子。维持这种丝造生命需耗费海量的灵丝资源，虽形态脆弱却真实鲜活。
NAME_SWAMP_SHAMAN,Groal the Great,伟大的格洛
NOTE_MITE,"Individually they offer little challenge, but their numbers are surely vast and most remain hidden.",单只不足为惧，但其庞大族群多潜藏暗处，如同阴影永难根除。
NOTE_PILGRIM_05,A lucky bug to be able to grow old. Pharloom&#8217;s roads take most much earlier.,能在纺络活到这样的年纪堪称奇迹，只可惜这份长寿化作了更持久的折磨。
DESC_CRYSTAL_DRIFTER_GIANT,Huge flighted creature formed from coldshard.,由冰晶碎片构成的巨型飞行生物。
NOTE_SHAKRA,"She has lived a mere fraction of my lifetime and yet her rings prove a ferocious match. As gifted a warrior as I have ever encountered, and one I am fortunate to call a friend.",她的年岁不过我生命的一小段，但她的战环却展现出凶狠的实力。她是我所遇过最出色的战士之一，很庆幸能和她成为朋友。
NOTE_BONE_THUMPER,"Sheer bulk makes for an effective weapon, but requires much sustenance. This creature would have spent most of its time eating. An acceptable life for some.",庞大的身躯是它们致命的武器，但也需要大量营养来维持。这种生物绝大多数时间都在进食，倒也活得纯粹。
NOTE_ABYSS_CRAWLER_LARGE,"These ones grow large, yet I have never observed them eating, or sleeping. They seem such simple bugs... but I suspect they are not truly our cousins.",体型虽庞大，却从未见其进食或休眠。看似普通的虫子……实则与我们并非同类。
DESC_BONE_BEAST,"Huge, hardbone bug that lives within and travels through the veins of old bells across Pharloom.",居住在古钟里并穿梭于纺络广阔钟脉里的骨甲大块头。
DESC_PILGRIM_03_SONG,"Winged devout of the Citadel, carrying a brace of gilded bells.",圣堡的带翼信徒，背负一对镀金巨钟作战。
NOTE_PEAKS_DRIFTER,"This one would make a perfect pet, but for the freezing temperatures it requires for comfort.",本可成为完美的宠物，但其生存需依赖刺骨的低温。
NOTE_DUSTROACH_POLLYWOG,"These creatures look to have been bred deliberately in watery pens. If they are food to be, their scent suggests they must taste vile.",刻意养殖的水栖变种，若作食用，其恶臭已昭示其滋味堪忧。
NOTE_BONE_HUNTER_CHIEF,"Their skill once saw them chosen, and I can plainly see why. They would have lived and trained only for this duty.",它们的高超技艺我已亲身体会，必然是终生磨练只为履行职责。
NOTE_PILGRIM_04_SONG,For this bug to have survived Pharloom&#8217;s climb it must have teamed with stouter companions. I cannot imagine it succeeding alone.,单凭自身的力量，这虫子绝无可能攀越纺络的天堑，成功进入圣堡。想必曾与更强壮的伙伴互为倚仗。
NOTE_PILGRIM_02_SONG,"Did this one grow large thanks to the Citadel&#8217;s excess, or was its formidable size the reason it ever survived to reach this place?",这家伙的巨大体型是因圣堡的恩赐而异变，还是正因其巨大体型才得以存活至此？
NOTE_SKULL_KING,"Though surely fierce, the skull it bears looks taken from an even larger beast. If not for the bones as proof, I would scarcely believe bugs could grow to such scale.",它头顶的骷髅战盔竟取自更庞大的生物——若非有骸骨为证，我简直难以相信世间存在如此巨虫。
NAME_BLADE_SPIDER,Pharlid,法利德蛛
NAME_FARMER_SCISSORS,Silk Snipper,裁丝疯匠
NAME_SONG_AUTOMATON_BALL,Cogwork Clapper,机枢击钹者
NOTE_CLOCKWORK_DANCER,"Two cogwork bugs, and yet the soul seemed singular? A sad, yet masterful imitation of life, imbued inside shells of iron.",两只自动机虫却共享单一灵魂？这是栖身于铁壳内的生命仿品，展现出精湛的制造技艺，却难掩其悲哀的命运。
NAME_BONE_WORM_BLUEBLOOD,Plasmid,生质幼蚓
DESC_DRAGONFLY_LARGE,Heavy insect that lives near large bodies of water. Its weighty body is best avoided.,栖息大型水域附近的笨重昆虫，遇到最好绕道而行。
NAME_BONE_CRAWLER,Kilik,刺铠虫
DESC_FLOWER_DRIFTER,Drifting bug disguised as a flower. Disperses crackling clouds of pollen if threatened.,伪装成花朵的漂浮生物，遇到威胁时会释放噼啪作响的花粉云自卫。
DESC_BLACK_THREAD_CORE,Dense knot of husks bound tight by void soaked Silk.,由虚空浸染的灵丝捆缚的躯壳，密集成团。
NAME_SONG_AUTOMATON_FLY,Cogworker,机枢工匠
NAME_SONG_THREADED_HUSK_SPIN,Dregwheel,残丝轮骸
NOTE_BLADE_SPIDER_HANG,"A smart hunter learns to wait long in ambush, always ready to strike the first blow.",优秀的猎手都懂得：耐心蹲点，一击必杀。
DESC_BONE_HOPPER,Grazing creature with sharp senses that nimbly retreats from danger.,感官敏锐的食草生物，遇到危险会灵活撤退。
DESC_FIELDS_FLOCK_FLYERS,"Tiny, timid creatures that huddle in flocks and flee at the first hint of danger.",胆小的小型群居生物，一旦察觉到危险便四散奔逃。
NOTE_DOCK_GUARD_THROWER,"Lost in the madness of the Haunting, they still commanded the endless excavation of their caves.",即便深陷丝咒癫狂，仍持续号令无休止的矿洞挖掘。
NAME_CROWMAN_JUROR_TINY,Craw Juror,腐囊陪审官
NOTE_GRASSHOPPER_SLASHER,"They rarely relax, always alert for potential danger, even deep in their own territory. To defeat them my focus must match their own.",就算在其领地深处，他们仍保持高度警戒。要想击败他们，我的专注力必须达到与其相当的水平。
DESC_SONG_AUTOMATON_02,"Steam shooting automaton, forged to clean the Cogwork Core and keep it free of infestation.",喷射蒸汽清洁机枢核心的自动机。
NAME_BONE_BEAST,Bell Beast,钟道兽
DESC_SLAB_FLY_SMALL,"Sticky young fly, born and grown in service to the Slab.",自幼服务于罪石牢狱的黏腻幼蝇。
NAME_HORNET_DRAGONFLY,Pendra,佩德拉
NAME_SHELLWOOD_WASP,Wood Wasp,木蜂
NAME_ROSARY_THIEF,Snitchfly,念珠窃贼
NOTE_SWAMP_DUCTSUCKER,"This mindless bug seems to sense only through its tendrils, yet despite that simplicity it still poses a serious threat.",虽只能凭借触须感知外界，这种虫子仍可以构成极大的威胁。
NAME_ASPID_COLLECTOR,Aknid,阿克尼
NAME_BONE_GOOMBA_LARGE,Skull Brute,头骨傀儡
DESC_PILGRIM_03,"Basic bug of Pharloom, laid low upon the ground.",匍匐在地的纺络平民。
NOTE_BONE_CRAWLER,"I am fond of simple, effective traps such as this bug&#8217;s extendable spikes. An unwary predator would be skewered clean through.",我很欣赏它这一招，简单有效。莽撞的捕食者肯定会被它的背刺一击穿透。
DESC_PILGRIM_04,Short pilgrim that uses their long horn to launch upon threats.,用长角将自己弹射向敌人的矮小朝圣者。
DESC_PILGRIM_05,Thick-set bug consumed by haunted thread. Uses their solid frame to crush others.,被诅咒之丝缠裹的壮硕老者，用沉重甲壳碾压敌人。
DESC_MOSSBONE_CRAWLER,Fur covered crawler with a series of sharp spikes along its back.,背部带刺的毛虫。
DESC_BONE_WORM,Burrowing worm that uses its many blunted teeth to dig through even the hardest bone.,拥有密集钝齿的穴居虫类，极其坚硬的骨质层也能被它们钻透。
NOTE_SLAB_FLY_BROODMOTHER,"With this one vanquished, I hope to have sped the end for that jail and its distasteful order.",击败她或将加速那座监狱与其恶心秩序的终结。
DESC_CORAL_SWIMMER_SMALL,Gelatinous coral drifter of simple mind and placid demeanour.,思维简单的凝胶状珊瑚生物，性情温和。
DESC_WISP_PYRE_EFFIGY,"Totem and god, built and worshipped by the Burning Bugs.",焚身信徒建造并敬奉的图腾神像。
NAME_CORAL_CONCH_SHOOTER,Driznit,掷面虫
DESC_FIELDS_GOOMBA,Skittish scrambler of the Far Fields. Its antennae resemble stalks of grass to aid in camouflage.,远野地区极易受惊的爬虫，触须能够伪装成草茎。
DESC_SLAB_FLY_SMALL_FRESH,"Infant fly, freshly hatched. At this age the soft, blind fly is little more than a bother.",刚破卵的盲眼软体幼蝇，不过是些烦扰的小东西。
NAME_CITADEL_BAT,Drapefly,帷虫
DESC_BONE_HOPPER_GIANT,Tall creature with sharp senses. Defends its herd with powerful legs and a sharp tipped mask.,感官敏锐的生物，以尖角面甲与强健后肢守护族群。
NAME_BONE_CIRCLER_VICIOUS,Vicious Caranid,狂躁刃尾蜂
DESC_SONG_PILGRIM_02,"Cruel physician of Whiteward, responsible for operations and modifications on the Citadel&#8217;s bugs.",白愈厅的残酷医者，负责对圣堡甲虫实施手术与改造。
NOTE_LAST_JUDGE,"The huge Judge likely stood through countless generations, never defeated, never wavering in their charge.",这庞然裁决者已矗立无数世代，未尝败绩，坚守职责从未动摇。
NOTE_FARMER_CATCHER,"These bugs look to have spent every waking moment at their work. Grim, endless labour in service of the unseen Citadel above.",这些虫子似乎将全部生命投入劳作。为自己从未见过的圣堡执行着阴郁无边的苦役。
NAME_SWAMP_GOOMBA,Miremite,蚀沼虫
NAME_GRASSHOPPER_FLY,Escalion,埃斯卡里昂
NAME_FLOWER_DRIFTER,Phacia,幻形花虻
NOTE_BONE_HOPPER,"Despite the Haunting of its shell, it has not been overcome with aggression. Its desire to flee remains too strong.",即使甲壳被丝咒侵蚀，其强烈的逃生本能依然压制住了被赋予的攻击性。
DESC_CORAL_GOOMBA_LARGE,"Coral hulk with a dense shell, bred to immense size by the Citadel&#8217;s Memorium.",被圣堡忆廊催生至庞然体型的珊瑚厚甲虫。
NAME_BONE_CIRCLER,Caranid,刃尾蜂
NAME_BONE_HUNTER,Skarr Stalker,斯卡尔追猎者
NAME_PILGRIM_BELL_THROWER,Pilgrim Bellbearer,朝圣钟卫
DESC_PILGRIM_02,Sturdy bug lost to the Haunting. Rolls at threats with no care for its own discomfort.,被丝咒侵蚀的健壮虫子。滚动碾压构成威胁的一切，无视自身痛楚。
DESC_GLOOMFLY,"Tiny empty creature, barely a bug. Swallows its prey whole and sucks their nutrients until nothing remains.",微型的虚无生物，几乎算不上是虫子。吞噬猎物至渣滓都不剩。
NAME_UNDERSTORE_SMALL,Underworker,圣厂工虫
NOTE_FLOWER_DRIFTER,Quite a beautiful creature. In my own kingdom&#8217;s court it would have been highly favoured as an ornamental pet.,如此美丽的生物。若在我故国的宫廷，定会成为贵族追捧的装饰性宠物。
NOTE_BONE_HOPPER_GIANT,"There is surprising strength hidden in their thin, elegant limbs. It would be a pleasure to ride upon it...",优雅纤细的后肢中蕴含强大的力量，若能驯服必是绝佳坐骑。
NOTE_SPINE_FLOATER,Whatever admiration I had for its fleecy down is spoilt by its disturbing mask... and its steely spines.,蓬松绒毛的吸引力被其阴森气质与钢刺彻底破坏。
NAME_FARMER_WISP,Burning Bug,焚身信徒
DESC_SHIELD_DOCK_WORKER,Cymbal bearing worker of the Deep Docks. Pans the hauls of smokerock to find traces of more precious minerals.,深坞持钹工人，筛选烟岩中的珍贵矿物残渣。
DESC_TAR_SLUG,Sticky mollusc that defends itself by spraying burning fluid from growths on its back.,通过背部凸起喷射燃烧体液的防御型软体生物。
NOTE_SWAMP_DRIFTER,"This one is pretty, but not as soft as first it seems. The plant it mimics is flaked and coarse, and the bug&#8217;s coat shares similar texture.",看似柔美实则粗粝，与其拟态植物的质感完全一致。
DESC_DOCK_WORKER,"Low level worker lost to Pharloom&#8217;s Haunting. Instinct keeps them at their task, though in much simpler fashion than before.",被丝咒侵蚀的低级劳工，仍凭本能重复着旧日工作。
NOTE_BLADE_SPIDER,"Something in their assault reminds me of my own skill, though their talents are born purely of instinct. My technique is formed from hard training.",攻击套路和我有几分相像。不过他们靠的是祖传本能，我则是勤学苦练。
NOTE_RHINO,Certain tools and skills can pierce its defences. I should adjust my strategy as needed.,正面硬撼绝非明智之举——只有特定的工具和技艺能撕开它的防御。
NAME_SILK_BOSS,Grand Mother Silk,苍白之母
NAME_ROACHKEEPER_CHEF,Disgraced Chef Lugoli,&#8220;失格大厨&#8221;卢戈利
DESC_FARMER_CATCHER,Bug charged to catch dregs of Silk that fall from the Citadel. Will attack with its staff if provoked.,专职收集圣堡掉落灵丝碎屑的劳工，受干扰时会挥杖攻击。
NOTE_MITEFLY,"Similar bugs would gnaw away at unguarded food supplies in my homeland. As a child I would hunt them, eager to make use of myself and test my skills.",我的故土也有类似的飞虫，它们会啃食未加看守的食物补给。年少时我经常猎杀它们，既为守护食物也为试炼技艺。
DESC_SONG_AUTOMATON_GOOMBA,"Automaton built in the shape of a scuttling bug. Its back contains retractable pins, intended to cut song cylinders free of any obstruction.",仿造爬虫外形的自动机，背部探针可切除阻塞音筒的障碍物。
NAME_SPIKE_SWIMMER,Steelspine Kai,钢脊凯虫
DESC_PILGRIM_STAFF_UNDERSTORE,Uses their steel bristled pin to scrub the soot from vents and pipes.,以钢鬃尖刺清理管道煤灰的劳工。
DESC_BONE_HUNTER_TRAPPER,"Huge, yet stealthy Skarr. An expert trapper and master of the undergrowth.",精通丛林陷阱的斯卡尔猎手，身形庞大却又善于潜行。
DESC_ABYSS_TENDRIL,"Lashing fragments of pure darkness, shaped into sharpened tentacles.",由纯粹黑暗凝聚而成的尖锐触手。
NAME_BELL_GOOMBA,Furm,绒甲虫
NAME_CLOCKWORK_DANCER,Cogwork Dancers,机枢舞者
DESC_BONE_GOOMBA_LARGE,"Soft bug beneath a huge, horned skull. Charges at intruders to protect its territory and its smaller companions.",顶着怪兽头骨的软体虫，为保护地盘和自身柔软的内部，常对入侵者进行无差别冲锋。
DESC_BONE_CIRCLER,"Common winged bug of the lowlands. Generally docile, but will attack if threats come close.",低地区域常见的温顺飞虫，不过被惹急了也会攻击来犯者。
NOTE_SLAB_FLY_SMALL,Foul creatures birthed into servitude. Their plight elicits no sympathy from me.,这些可悲的生物从蛹中钻出的瞬间，就被烙上了终生奴役的印记——但它们啃噬死囚腐肉时发出的欢快嗡鸣，实在让人难以怜悯。
NOTE_SHIELD_DOCK_WORKER,"The Haunting has stolen some important part of these bugs, yet still they attempt their former task. Until, that is, they sense my presence...",它们机械地重复着筛矿动作，直到感应到活物气息——那一刻，铜钹便化作呼啸的断头刃。
NAME_CONDUCTOR_BOSS,The Unravelled,散茧魂渊
NAME_CORAL_SWIMMER_SMALL,Yuma,尤玛
DESC_BONE_WORM_BLUEBLOOD,Mutated young worm infected with Plasmium. The new form displays potent regenerative skill.,受生质液感染而变异的蠕虫幼体。其新形态展现出强大的再生能力。
NAME_MOSSBONE_MOTHER,Moss Mother,苔翼母虫
NOTE_SONG_AUTOMATON_01,"Its core is filled with fine mechanisms, but that alone should not produce such a convincing mimic of life. Silk must also be used to animate this artifice, though exactly how I am not sure.",当灵丝顺着齿轮缝隙游走时，这台机器竟发出类似心跳的震颤——圣堡匠人究竟将多少生命奥秘编织进了这些钢铁躯壳？
NOTE_STICK_INSECT_CHARGER,"Its shell gives it the advantage of surprise, but also forces it into a slender, brittle shape that cannot withstand a heavy attack.",拟态外壳带来突袭优势，但纤细脆弱的体型难以承受重击。
DESC_LILYPAD_TRAP,Predatory plant with a powerful jaw shaped to resemble a lily pad.,伪装成睡莲的捕食性植物，拥有强有力的颚部。
NAME_SHIELD_DOCK_WORKER,Smokerock Sifter,烟岩筛工
NAME_GRASS_GOOMBA,Leaf Roller,卷叶虫
DESC_MITEFLY,"Airborne pest, less common than its grounded siblings. Attacks with sharp fangs if agitated.",其陆行同类的飞行变种，较为稀少。受到刺激时会使用利齿攻击。
NOTE_CONDUCTOR_BOSS,"The souls of so many bugs, obsessed with Silk, consumed by it. Their pain shall forever remain in that pit. Even I do not possess strength enough to cleanse it.",无数沉溺灵丝终被吞噬的灵魂，其苦痛将永远禁锢在这坑里。纵使是我也无力净化。
DESC_LOST_LACE,Silk-spun child possessed by the void.,被虚空侵蚀的灵丝造物。
DESC_ABYSS_CRAWLER,Shell-plated worm found only in the deepest depths. Seems to survive despite consuming no food or liquid.,仅存于最深处的甲壳蠕虫，无需进食或饮水仍能存活。
NAME_SONG_PILGRIM_03,Choristor,圣咏使徒
NAME_SCROLLKEEPER,Scrollreader,诵经使
DESC_SWAMP_MUCKMAN_TALL,Trap setting bug carrying a pouch of sharpened long-stakes.,携带尖锐长木桩布置陷阱的虫子。
NAME_CITADEL_BAT_LARGE,Drapelord,帷虫之主
DESC_GNAT_GIANT,"Aged female mite, grown larger and stronger than most of its kin.",年迈的雌性螨虫，体型力量都远超同类。
DESC_ABYSS_MASS,Mass of old masks swollen and animated by writhing void.,由纠缠的虚空驱动而膨胀、复活的一团古老面甲。
DESC_ROSARY_THIEF,Pernicious looter found all over Pharloom.,在纺络全境四处劫掠的卑劣盗虫。
DESC_SLAB_PRISONER_FLY_NEW,"Small bug, shackled and cowled for sin committed within the Citadel.",戴着镣铐，被蒙住头部的圣堡罪徒。
DESC_HORNET_DRAGONFLY,Flighty insect that lives beside still waters.,栖息静水边的敏感飞虫。
NOTE_SONG_AUTOMATON_GOOMBA,"Its form is certainly based on bugs found outside the Citadel. In my own craftwork, I too often look to nature for inspiration.",那对仿生复眼能精准识别音筒纹路，探针起舞时溅起的火花，竟在钢壁上刻出类似灵丝符文的痕迹。
NAME_SONG_HANDMAIDEN,Clawmaiden,丝偶侍女
NOTE_PILGRIM_04,Birth equipped this one well. In its assault it becomes its own projectile.,它们生来就是活体投掷物——将整个身躯化作飞矛，用长角贯穿目标。
NOTE_DOCK_CHARGER,"Their heavier bells armour them well against my strikes, but against that oppressive heat... can they help at all?",它们厚重的钟甲可以抵挡我的针刃，但在酷热环境中恐怕难有作为。
