Key,EN,ZH
NAME_RHINO,Rhinogrund,犀角掘地兽
NOTE_PILGRIM_STAFF_UNDERSTORE,Their sharp cleaning implement is as filthy as the rest of the place. They only layer grime on grime.,他们的清洁工具与周遭同样污秽，这样打扫只会越来越脏。
DESC_SONG_REED_GRAND,"High standing insect of the Choir, bearing a bow. This elite Reed has been trained and fed beyond its smaller fellows.",圣咏团中地位崇高的虫子，持弓而立。比起普通的簧片战士，这位精英成员受过更严格的训练，也享有更丰盛的供养。
NOTE_SONG_CREEPER,"It lies low to the ground, perhaps out of reverence for its task, but can spring up suddenly to attack. Its shear makes for a deadly weapon with surprising reach.",那柄形似剪枝钳的武器，既能精准剥离甲壳中的灵丝脉络，也能在瞬间绞碎试图逃逸的灵魂残片。
DESC_UNDERSTORE_AUTOMATON_EX,"Small automaton with a shielded shell, intended to carry loads of dangerous flintflame.",配备防护甲壳的小型自动机，负责运输危险的燧焰。
NOTE_GARMOND_ZAZA,"They too seek the spectre at the Haunting&#8217;s heart, though I fear that foe would pose a challenge beyond their mortal limits.",他们同样在寻找那丝咒之源的幽魂——只是我担心，我们共同的敌人是超越凡虫极限的存在，恐怕不是他们所能应对的。
NOTES_DEFEAT,Defeat {0} more to complete the hunter&#8217;s notes.,再击败{0}只以解锁猎手的笔记。
NAME_ARBORIUM_KEEPER,Memoria,忆廊使徒
DESC_CORAL_CONCH_SHOOTER,Nesting creature that fuses its face with sharpened coral.,将面部与珊瑚融为一体的巢居生物。
NOTE_PILGRIM_MOSS_SPITTER,"The moss looks to grow even inside their stomach, which the pilgrim spits at foes in compressed gobs. A foul form of offence.",苔藓甚至在其胃囊内滋长，被压缩成团的腐殖质带着刺鼻腥气——这恐怕是纺络最肮脏的远程武器。
DESC_SONG_AUTOMATON_BALL,Rare automaton intended to perform the ringing of bells and cymbals in the depths of the Core.,专为敲击钟钹设计的稀有自动机。
DESC_SONG_PILGRIM_03,"Disciple of the Choir, elevated above other pilgrims, and forced to cowl their face forever more.",蒙面的高阶信徒，地位远超普通朝圣者。
NOTE_MITE_HEAVY,"Pharloom&#8217;s structures seem almost built for them. The endless corners and cracks, so perfect for mites to burrow and nest.",纺络的建筑结构仿佛为其量身打造，这里有无尽的角落和缝隙供螨虫打洞筑巢。
DESC_CRYSTAL_DRIFTER,Flighted creature formed from coldshard. If shattered it will quickly reform.,由冰晶碎片构成的飞行生物，破碎后可以迅速重组。
NOTE_BONE_GOOMBA,"In every land, creatures find new and surprising ways to disguise themselves. One must be wary always.",不论在哪一片土地上，万物皆有巧妙的伪装法门，行走此间当时刻保持警觉。
DESC_BONE_CIRCLER_VICIOUS,"Aggressive winged bug of the lowlands. When angered, it rapidly whips its bladed tail as a weapon.",低地区域的暴躁飞虫，一生气就把带刃的尾巴甩成风车。
DESC_BONE_HUNTER_CHILD,Young ant hunter wielding sickles carved from teeth. Will often call for aid if danger comes close.,使用兽牙镰刀的年轻蚁族猎手，遇险时会呼叫支援。
DESC_CORAL_BUBBLE_BRUTE,"Overgrown elder, able to spawn burning bubbles from within its coral-cased shell.",与珊瑚融合的长老巨虫，能从甲壳内喷发炽热气泡。
NAME_SONG_ADMINISTRATOR,Minister,圣咏大臣
DESC_SPLINTER_QUEEN,Imposing old insect nesting in the heights of Shellwood. Her command of twig and branch ensured no pilgrim ever survived within her territory.,盘踞甲木林高处的碎裂者女王，掌控树丛枝干屠尽领地内所有朝圣者。
NOTE_CORAL_BUBBLE_BRUTE,"This bug&#8217;s fusion with the crust-growth... It seems intentional, though I imagine the union is far from comfortable.",这种融合看似自主选择，但其过程必定充满痛苦。
NOTE_UNDERSTORE_AUTOMATON_EX,Born and built only to work until time stiffens its limbs. Perhaps it is mercy this construct knows nothing of the freedom it lacks.,生来只是为了劳作，直到岁月令它四肢僵硬。也许它对自己所缺失的自由一无所知，这反倒是一种仁慈。
NAME_MOSSBONE_CRAWLER,Mossgrub,苔原蠕虫
NAME_CROW,Craw,腐囊虫
DESC_SHAKRA,Warrior cartographer of a tribe from Pharloom&#8217;s edge. Her skills in battle could challenge the kingdom&#8217;s best.,纺络边陲部落的勇士制图师，其战力在纺络可谓数一数二。
NAME_SONG_AUTOMATON_GOOMBA,Cogwork Crawler,机枢巡游者
NOTE_PILGRIM_01_SONG,"Once one of Pharloom&#8217;s favoured bugs, and yet their domain and their shells would have been the first to fall to the Haunting.",曾经纺络的荣光加身者，却成为首批丝咒受害者。
NOTE_CORAL_GOOMBAS,"Hidden amongst their tower&#8217;s matching crust, these smaller bugs would have survived and thrived.",这些小虫子依靠伪装得以繁衍生息。
NOTE_SPLINTER_QUEEN,This one lived long and fed much. The wood will be much safer for their slaying.,她存活久远且吞噬无数，诛杀她将使丛林安全倍增。
NAME_SWAMP_MOSQUITO_SKINNY,Spit Squit,酸涎飞蚋
NOTE_CORAL_SWIMMER_FAT,"They once teemed around their tower, in numbers immense. It is a rare chance to witness such a bountiful display of life.",其数量曾经可谓铺天盖地。目睹此等生命奇观的机会已越发稀少。
NAME_CORAL_BUBBLE_BRUTE,Corrcrust Karaka,珊瑚卡拉卡
DESC_BELL_GOOMBA,Burrower that nests in the Bellvein and seeks out hard bells to protects its soft body.,在钟脉内部打洞栖息的毛球状虫类，专门找硬钟壳当作盔甲。
NOTE_CORAL_CONCH_SHOOTER,"It is easy to be caught off-guard by the ricocheting trajectory of its flung mask, especially in tight corners.",投掷面甲的反弹轨迹难以预判。在狭窄空间尤其需要提防其袭击。
NOTE_PILGRIM_STOMPER_SONG,"Time allowed their shell to grow thick, all the better for battering their targets.",岁月让它们的甲壳变得厚重，能更轻易地猛击目标。
NAME_UNDERSTORE_AUTOMATON_EX,Cogwork Hauler,机枢搬运工
NAME_FARMER_CATCHER,Dreg Catcher,灵丝筛工
DESC_BLADE_SPIDER_HANG,Arachnid that nestles within dark holes in cavern roofs. Pounces on prey from far above.,隐藏在洞顶暗处的蜘蛛，擅长从高处一跃而下，偷袭猎物。
NAME_GRASSHOPPER_CHILD,Kindanir,金达尼尔
NOTE_GIANT_CENTIPEDE,A monster in the classic form of tales from youth. Its slaying was done as much by my fierce travelling companion as by myself.,童谣所述的经典魔物形态。此次诛杀多靠了我那勇猛的旅伴。
NAME_GNAT_GIANT,Mitemother,螨母
NOTE_CORAL_CONCH_STABBER,Passively waits for prey to blunder into its path. A technique that should not necessarily be derided. Whatever is effective is best.,静静等待猎物误入其攻击范围。看似消极的捕猎方式，往往能收获意外成效。
NOTE_LIFEBLOOD_FLY,"My unique shell can resist the darker deformations of this substance, but even I have limits...",我的甲壳虽能抵抗此物质带来的畸变，但承受力终有极限。
DESC_CROWMAN_JUROR_TINY,Screeching scavenger dyed black in mourning at their land&#8217;s collapse.,大地倾覆之际，绝望哀叫的黑色食腐虫。
NAME_WHITE_PALACE_FLY,Wingmould,飞行傀儡
NOTE_GLOOM_BEAST,"Amazingly, the creature carries the void&#8217;s black liquid in its stomach, violently spraying it forth if threatened.",神奇的是，它竟能将虚空黑液储于胃中，受威胁时剧烈喷吐攻击。
NOTE_POKE_SWIMMER,A critical member of the larger flock. Without them present the Kai would be fast driven to extinction by larger predators.,它们是族群存续的关键——当凯旋转尖角筑起防御阵时，连髓骨洞窟的暴君都要暂避锋芒。
DESC_ROSARY_PILGRIM,Strong bug replete with rosaries. If angered they will whip their strings in a ceaseless onslaught.,缠满念珠的强壮虫子，发怒时会挥舞珠串猛攻。
NOTE_SWAMP_MOSQUITO_SKINNY,To subsist on the sickly water in this fetid environment it spits out the most toxic elements. Over generations this former survival technique has turned into an effective hunting tool.,过滤毒液的生存机制经代际演化，成为高效的狩猎手段。
NAME_UNDERSTORE_HEAVY,Undercrank,圣厂维修工
NAME_UNDERSTORE_MITE_GIANT,Giant Drapemite,巨型帷螨
NAME_PILGRIM_04_SONG,Choir Flyer,圣咏飞卒
NOTE_CROWMAN,Far more hostile than their younger companions but seemingly less likely to roam far from their nest.,看似凶暴，实为恋巢的保守派。
NAME_PILGRIM_02_SONG,Choir Hornhead,圣咏角首
DESC_TORMENTED_TROBBIO,"Depressed thespian, consumed by the melancholy of a collapsing world.",被世界的崩解压垮的消沉演员。
DESC_ROACHKEEPER_CHEF,"Once exulted chef, exiled from the Citadel for repeated culinary crimes.",曾经备受赞誉的大厨，却因屡次触犯烹饪禁忌而被逐出圣堡。
DESC_UNDERSTORE_SMALL,Feeble servant of the Underworks with a long twistpin and hard shell.,手持长柄旋针的虚弱硬甲劳工。
DESC_SLAB_FLY_MID,"Starved servant of the Slab, bearing a hooked longpin.",饥肠辘辘的罪石牢狱仆从，手持钩形长针。
NAME_SWAMP_DRIFTER,Mothleaf Lagnia,娥叶虫
DESC_SONG_AUTOMATON_FLY_SPIKE,"Spherical, winged automaton housing many sharp spikes.",装载尖刺的球型飞行自动机，防御功能存疑。
NOTE_BONE_CIRCLER,"Their plump, round shape makes them well-suited for target practice. Difficult to resist testing my aim on them...",圆滚滚的身材十分适合用作靶子，不拿来练手都可惜……
DESC_CITADEL_BAT_LARGE,Elder Drapefly grown big from age and consumption. Its heavy body allows it to hit much harder than its younger companions.,年迈体硕的帷虫，沉重的身躯赋予其强劲的冲击力。
NAME_GRASSHOPPER_SLASHER,Verdanir,维达尼尔
DESC_LAST_JUDGE,"Final arbiter of the Blasted Steps, tasked to ensure only the sinless ever step beyond the Grand Gate.",蚀阶的最终裁决者，确保唯有无罪者能跨越巨扉圣门。
NOTE_TORMENTED_TROBBIO,This one chose to embrace the doom to come. I shall not share such easy surrender.,他选择臣服于灾难的降临，我绝不会效仿这种懦弱行径。
NAME_GIANT_CENTIPEDE,Bell Eater,噬钟者
DESC_PEAKS_DRIFTER,Gentle glider of Mount Fay. Its downy wings and cowl allow it to resist even the most cutting cold.,费耶山的温顺滑翔者，其绒翼可抵御极寒。
DESC_CORAL_BRAWLER,"Heavy, hard-shelled charger relying on weight and strength.",依赖蛮力的重甲生物。
NOTE_FIRST_WEAVER,"This one&#8217;s husk held a masterful talent, to weave Silk into blazing runes. Throughout my life, I have seen runes woven for many tasks. Was she the first to hone such skills?",其躯壳曾掌握将灵丝编织为燃烧符文的绝技。纵观我毕生所见的各类符文，她或是这项技艺的开山鼻祖？
NAME_PHANTOM,Phantom,幽影
NOTE_GLOOMFLY,This one disturbs me... There is something in its simplicity. Do I almost feel fear?,这东西令我感到不安……其纯粹性中蕴含某种诡异的特质。我竟然感到一丝恐惧？
NAME_SONG_HEAVY_SENTRY,Choir Clapper,圣咏槌手
NAME_CROWMAN_DAGGER_JUROR,Squatcraw Juror,矮陪审员
NOTE_CLOVERSTAG_WHITE,Myth made real in memory. The creature seemed completely at one with the flora around it. Did it ever truly exist as I have seen it?,传说中的生物在忆境中成为了现实，与周遭植物浑然一体。我所见到的一切，真的曾经存在过吗？
NOTE_GRASS_GOOMBA,Simple. Graceful. Another fine bug lost forever from these lands.,简约而优雅。又一个永远从这片土地消失的美丽物种。
NAME_SKULL_KING,Skull Tyrant,骷髅暴君
NOTE_TROBBIO,"His desire to see Pharloom saved may have been well intentioned, but he seemed quite happy for others to die upon the stage in pursuit of his goal.",他拯救纺络的愿望或许出于善意，但为实现目标似乎乐于目睹他人在舞台上殒命。
NAME_CENTIPEDE_TRAP,Garpid,加尔皮德
DESC_DOCK_BOMBER,Brave worker carrying unstable flintflame and wearing a heavy bell to protect against potential ignition.,运输燧焰的工虫。燧焰性质不稳定，所以它们需要佩戴重型防爆钟罩。
NOTE_ROCK_ROLLER,"Its bright gems could be used to make beautiful, but short-lived jewellery. An amusing idea for a gift... or a trap.",每次甲壳碰撞都会迸发火星，这使得它们的巢穴成了行走的火药库。
DESC_BONE_HUNTER_TINY,"Small burrowing ant, servant to the larger Skarr.",为大型斯卡尔蚁服务的小个子掘地工。
DESC_SLAB_FLY_LARGE,"Heavy, hairy jailer responsible for capturing sinners, and punishing prisoners.",厚重的多毛蝇虫，负责抓捕罪犯和惩戒囚犯。
DESC_MOSSBONE_FLY,Small fluttering creature capable of defending itself with its small stinger.,小型飞虫，使用自身毒刺进行攻击。
DESC_PILGRIM_01,"Agile bug of Pharloom, its higher functions have been lost to the Haunting.",被丝咒夺去神智的敏捷朝圣者，仅存扑跃攻击的本能。
NAME_SONG_AUTOMATON_02,Cogwork Cleanser,机枢清道夫
DESC_CORAL_WARRIOR_GREY,"Old warrior guarding the border of their domain, stiffened by time and awoken by song.",守卫疆界的沧桑老将，因古老歌谣而苏醒。
NOTE_SWAMP_MOSQUITO,More dangerous in the moment of its explosive and corrosive death than it ever was in life.,其死亡瞬间的腐蚀性爆炸远比生前更具威胁。
NOTE_CORAL_WARRIOR,"The core member of a powerful order, trained fearless and faithful. Theirs was a kingdom of warriors, one built upon their blades.",作为精锐战团的骨干成员，经受了严酷的训练，无畏且忠诚。它们建立的刀锋王朝，正是尚武精神的巅峰体现。
NAME_SCHOLAR,Vaultkeeper,书库管理员
NAME_SONG_REED_GRAND,Grand Reed,精英簧片战士
NOTE_SHELLWOOD_GNAT,"If the woody hide is shattered, the bug will still bravely, foolishly try to attack.",它们至死都坚信那截空心木茎是神赐的圣枪——可悲的勇气，或是可敬的愚忠？
DESC_SONG_SCHOLAR_ACOLYTE,"Young acolyte raised in the darkest vaults, destined to ascend to the rank of Scrollreader.",低语书库培育的诵经者接班人。
NAME_LILYPAD_TRAP,Nuphar,睡莲狩猎者
DESC_ARBORIUM_KEEPER,Learned disciple of the Choir charged to maintain the Citadel&#8217;s Memorium.,受命维护圣堡忆廊的博学咏者团信徒。
NOTE_SILK_BOSS,"Heart of the Haunting, long lulled to slumber and desperate to wake. The higher being&#8217;s threads stretched throughout Pharloom, snaring its bugs and driving them to madness and discord.",丝咒的核心，长久沉眠却渴求苏醒。她的丝线遍布纺络，诱使这片土地上的虫子陷入疯狂。
DESC_GARMOND_ZAZA,"Vigorous old knight and their noble companion, working together to see their lands cut free from haunted madness.",精力充沛的老骑士与他忠诚的同伴。他们并肩作战，誓要将自己的家园从丝咒的疯狂中解救出来。
DESC_ASPID_COLLECTOR,Winged insect that feeds upon moss and lichen in the caves above Bone Bottom.,栖息于骸底镇上方洞窟的飞虫，以苔藓地衣为食。
NAME_DOCK_GUARD_THROWER,Forebrothers Signis &amp; Gron,监工兄弟 西格尼斯&amp;格隆
NAME_HUNTER_QUEEN,Skarrsinger Karmelita,&#8220;斯卡尔歌后&#8221;卡梅莉塔
DESC_PHANTOM,Mournful creature tasked alone to expel the Citadel&#8217;s choking refuse. Their talent with a longpin is unmatched.,独自清理圣堡秽物的哀伤生物，长针技艺登峰造极。
NOTE_BONE_WORM,They ceaselessly churn through rock and bone without ever seeming to rest. Do they have a destination? Or are they compelled to dig forever deeper?,它们似乎永远不知疲倦地向下挖掘。究竟是有目的地前进，还是被迫永无止境地穿行？
DESC_BLOAT_ROACH,"Obese offshoot of Muckroaches, born of the Citadel&#8217;s exhaust smog. The winged roach&#8217;s sagging stomach is filled with sizzling bile.",圣堡废气催生的肥胖蟑螂变种，鼓胀的腹部储存着沸腾胆汁。
NAME_BONE_THUMPER,Marrowmaw,髓渊兽
DESC_FIRST_WEAVER,Ancient Weaver condemned for a transgression lost to time.,远古时期因某项重罪被囚禁的古老织者。
NOTE_CORAL_CONCH_SHOOTER_HEAVY,A fine shot with its sharp mask. Its aggression has no ill effect on its aim.,面甲投掷精准异常，暴戾的性情并未损耗其分毫准度。
NAME_UNDERSTORE_POKER,Underpoke,圣厂残工
NOTE_SPIKE_SWIMMER,"Seeming soft, but hiding a sharp surprise. Any larger predator attempting a bite would learn a pointed and painful lesson.",看似柔软实则暗藏杀机，掠食者的撕咬只会换来锥心之痛。
NOTE_WRAITH,Not a bug but a projection of another&#8217;s will cast in smog and Silk.,烟雾与灵丝交织的意志投影，并非实体生物。
NAME_SWAMP_MOSQUITO,Swamp Squit,沼栖飞蚋
DESC_WEAVER_SERVITOR_LARGE,"Broken construct built by Weavers past, able to fire a focused beam of silklight to carve halls and chambers through ice and bone.",破损的古织者装置，能聚集并发射灵丝光束凿穿冰体和骸骨，通常用来开凿厅室。
NAME_DOCK_CHARGER,Deep Diver,深潜者
DESC_WISP,Short-lived sprite born of flickering flame.,闪烁火焰孕育出的精灵，其生命往往转瞬即逝。
DESC_SPIKE_LAZY_FLYER,"Slow drifting bug with a heavy top shell. The bug reacts little to threats, even those that could claim its life.",顶覆厚重甲壳的漂浮虫，行动迟缓，对致命威胁也都反应微弱。
DESC_DOCK_CHARGER,"Bell-clad bug responsible for mining the deeper, treacherous depths below their docks.",负责开采深坞下方危险矿区的虫子，身覆钟甲。
DESC_SWAMP_BARNACLE,Toothy growth that lives on cave roofs. Wraps wayward bugs with its long tongue and drags them up to be consumed.,栖身洞顶的齿舌生物，用拟态长舌诱捕猎物。
DESC_LILYPAD_FLY,Fine winged flyer that survives in flocks.,优雅的群居飞虫。
DESC_GIANT_CENTIPEDE,"Long dormant centipede, awoken and enraged by Pharloom&#8217;s crumbling collapse.",长期蛰伏的远古蜈蚣，因纺络的崩塌而苏醒、暴怒。
NAME_SHAKRA,Shakra,沙克拉
DESC_CITADEL_BAT,"Erratic, flying pest that nests in rags and curtains.",寄居在破布和帷幔中的飞虫，居无定所。
NAME_SLAB_FLY_SMALL,Scabfly,痂蝇
NOTE_PILGRIM_FISHER,"Once a hunter purely for food, now they hunt unthinking and unending.",曾是只为果腹而捕猎的猎手，如今却在丝咒驱使下沦为永不停歇的屠夫。
NOTE_LILYPAD_FLY,So light they can rest atop still water&#8217;s surface. An elegant bug indeed.,轻盈得能栖于静水表面，确为优雅之虫。
NAME_FARMER_CENTIPEDE,Thread Raker,残丝耙工
NOTE_BLOAT_ROACH,Its form is absurd... Surely it should not be able to hold itself in the air? The noxious gases in its stomach must provide its levity.,如此畸形的躯体竟能悬空？想必是腹中毒气提供了浮力。
NOTE_SHELL_FOSSIL_MIMIC,"Once roused, the bug will crash its steely shell into walls, floors and foes.",被惊动后，会以钢甲撞击墙壁、地面与敌人。
NAME_BONE_HOPPER_GIANT,Hardbone Elder,巨骨长者
DESC_CROWMAN_JUROR,Elder crawbug serving in a sacred ceremony.,参与神圣仪式的腐囊虫长老。
NAME_SONG_PILGRIM_01,Envoy,圣咏特使
NAME_ROSARY_PILGRIM,Covetous Pilgrim,念珠朝圣者
DESC_PILGRIM_01_SONG,"Agile bug, and one of few hardy pilgrims to have reached the Citadel.",成功抵达圣堡的敏捷朝圣者。
NOTE_SONG_PILGRIM_03,"Their use of a pin shows hard training. Their use of Silk, unfurled from a spool held close, shows skill far beyond standard bugs.",其刺针技法明显是经过严格训练，近身灵丝轴的操控技艺更是远超普通虫子。
DESC_CORAL_JUDGE,"Gilded guardian of the Blasted Steps, bearing a cymbal and mallet.",镇守蚀阶的金甲守卫，用钹和木槌处决&quot;不洁者&quot;。
DESC_SWAMP_DRIFTER,"A rare, calmer bug of Bilewater, survives its hazardous surroundings by hiding as a plant.",腐汁泽罕见的温顺虫子，在危险的环境中拟态植物，得以生存。
DESC_SONG_AUTOMATON_01,"Bug forged of iron, rotor and cog. The automaton works tirelessly to maintain the Core that houses it.",由齿轮与转子构成的铁质自动机，不知疲倦维护着机枢核心。
DESC_DUSTROACH,"Starved pack bug with an insatiable appetite. Despite their tough hide and pungent meat, roaches breed rapidly so are sometimes farmed for food.",贪婪的群居害虫，甲壳坚硬，虫肉腥臭，却因繁殖力超强被圈养作为为食物来源。
NOTIFICATION_FULL,Journal Updated,日志已更新
NAME_ABYSS_CRAWLER,Shadow Creeper,阴影爬虫
NOTE_MAGGOTS,"They cling fast to the shells of other bugs, destroying any hope for concentration or comfort.",它们紧附其他虫子的外壳，彻底摧毁宿主的专注力与安宁。
DESC_SHELLWOOD_WASP,"Pointed, darting insect that builds a hardy hive from Shellwood&#8217;s dried bark.",以甲木林干树皮筑巢的尖刺飞虫。
DESC_UNDERSTORE_MITE_GIANT,Full-sized mite of the Citadel cloaked in an old curtain.,披挂破旧幕帘的圣堡巨型螨虫。
NAME_CRYPT_WORM,Gromling,戈鲁姆幼虫
NAME_BONE_WORM_BLUETURRET,Plasmidas,生质巨蚓
NOTE_LILYPAD_TRAP,"A snapping surprise on first encounter, though one easily avoided once aware.",初次遭遇的惊险过后，便再难构成威胁。
NAME_MITE_HEAVY,Drapemite,帷螨
NAME_BONE_HUNTER_TINY,Skarrlid,斯卡尔工蚁
NOTE_BONE_HUNTER_TRAPPER,"His tracks and traps... It should have been obvious from the start, this old hunter sought to draw me in. But what reason drove him to test himself so brutally? That answer I suspect I shall never know.",早该察觉他的踪迹与陷阱……但这老猎手对自己进行如此残酷试炼的原因，看来是无从得知了。
DESC_ROACHKEEPER_CHEF_TINY,Brutish cook responsible for dicing Muckroach meat into edible portions.,粗鲁的厨子，负责将淤秽蟑螂肉切分成便于食用的分量。
DESC_SONG_AUTOMATON_FLY,"Flighted automaton, responsible for repairing and extending the Core.",负责维修扩建核心的飞行自动机，简单攻击暗藏杀机。
DESC_BONE_THUMPER,Giant roller of the lowlands. Its ridged hide will crush smaller creatures beneath it.,在低地区域横冲直撞的巨型生物，带棱甲的躯体能轻易碾碎小型生物。
DESC_SONG_THREADED_HUSK_SPIN,"Shell of a small bug possessed by Silk dregs. The husk will stretch its Silk to form a crude, crushing wheel.",被灵丝残渣附身的小型甲虫躯壳，伸展灵丝形成粗糙碾压轮。
DESC_CROWMAN,Rag-winged adult crawbug bearing a scavenged pin.,翅膀破烂的腐囊成虫，使用捡来刺针作为武器。
NAME_DUSTROACH,Muckroach,淤秽蟑螂
NOTE_SONG_AUTOMATON_BALL,"I have not yet seen the bell this automaton is designed to ring, nor do I ever wish to hear it. Such a clamour would no doubt be unpleasant to experience.",它们机械臂摆动的节奏暗合圣咏旋律，若真让这些击钹者齐聚奏响终章，恐怕整个机枢核心都会在共振中崩塌。
NAME_CLOVERSTAG_WHITE,Palestag,苍白苜鹿
NOTE_CORAL_JUDGE_CHILD,"If allowed the opportunity, these creatures will grow into a form larger and more oppressive.",此刻脆弱，却是未来灾祸的种子。放任其成长将成为巨大威胁。
NOTE_SETH,"He offered fair warning and challenge, a duel in the purest sense. I admire his honour, and his skill.",他向我发起了正式的挑战，那是一场最纯粹的决斗。我敬佩他的荣誉感，也钦佩他的技艺。
DESC_STICK_INSECT_CHARGER,"Insect formed to imitate a branch, born with sharp, retractable horns atop its head.",头部配备可收缩尖角的拟态树枝虫。
DESC_BONE_GOOMBA,"Small, soft bug that uses the hard skulls of the Marrow for protection and disguise.",小型软体虫，利用髓骨洞窟内硬质头骨作为自己的护甲和伪装。
NOTE_FIELDS_FLYER,"When roosting, it would look convincingly plant like. In flight, its bulbous body quickly ruins the ruse.",停栖时，双翼能完美伪装成远野的草叶。但这小聪明总在飞行时露出破绽——它膨大的腹部让伪装功亏一篑。
NAME_CORAL_FLYER_THROW,Yago,雅戈
NAME_FIELDS_FLYER,Flapping Fertid,拟草蛾
DESC_MITE_HEAVY,Cloth-covered crawler with sharpened forelimbs. Lives and breeds in dark places.,栖息暗处的爬虫，身覆布料，前肢锐利。
NAME_BELL_FLY,Winged Furm,披钟绒甲虫
NOTE_UNDERSTORE_THROWER,The cost of so much grandeur... Did I peer closely enough into the foundations of my own kingdom?,辉煌背后的代价……我是否也曾如此审视过自己王国的根基？
DESC_CROWMAN_DAGGER,Stout adult crawbug bearing several short pins.,手持短刺的矮胖腐囊成虫。
NAME_TAR_SLUG,Lavalug,熔岩蛞蝓
NOTE_CITADEL_BAT_LARGE,Greed will always see some bugs swell above their kin.,贪婪终会导致膨胀，这是所有生物共通的教训。
NOTE_HUNTER_QUEEN,"This graceful ruler once possessed skill to rival my own. At her youthful peak, her voice united all Skarr in her service.",这位优雅的统治者曾拥有与我匹敌的武艺。在她巅峰时期，其歌喉能让所有斯卡尔蚁族臣服效命。
DESC_WHITE_PALACE_FLY,False fly with a rune etched shell. A tortured mix of soul and void is caged within.,外壳刻有符文的飞虫形装置，内部囚禁着灵魂与虚空的痛苦混合物。
DESC_SWAMP_DUCTSUCKER,Suction creature surviving on the thick slime that coats its caves.,依赖洞壁浓稠粘液维生的吸附生物。
