Key,EN,ZH
WOOD_WITCH_CURSE_ACCEPTED,&lt;hpage&gt;Very well. This final rite... what would you have me do?&lt;page&gt;The time... of birth is close. Now give... its shell. Host... the final rite.&lt;page&gt;The time of birth... is near.,&lt;hpage&gt;好吧。这最终仪式……需要我做什么？&lt;page&gt;诞生……之时。献出……甲壳。宿主……终仪。&lt;page&gt;诞辰……已至。
SETH_GUARDIAN_TALK_REPEAT,"You may rest here in this sacred place, but know, if you choose to step further, you shall see my weapon raised.",你可以在此处休息，但记住，越界意味着面对我的兵刃。
WOOD_WITCH_CURSE_OFFER,The time... the time of birth approaches. The bud cries. Yearning. The final rite may begin.&lt;page&gt;White shell. Red cloak. Bug strong and old. The time of birth is near. Aid now the final rite.,时刻……诞生之时将至。花苞啼哭。终仪可启。&lt;page&gt;白面红袍。古老强虫。诞生之时已至，此刻助我终仪。
WOOD_WITCH_FLOWER_QUEST_COMPLETE_1,"P... Pollip Hearts. Gathered. Gathered all. All that is needed, is given.",花……花芯。集齐。所需皆备。
WOOD_WITCH_FLOWER_QUEST_DECLINE,"&lt;hpage&gt;I hear your request, but I must decline. My travels will take me far beyond this wood.&lt;page&gt;Decline. No. Decline, not. The time of birth approaches. The first rite must begin.",&lt;hpage&gt;很遗憾，我有要事在身，没法帮忙。&lt;page&gt;拒绝。不可。诞生之时将至。仪式必启。
WOOD_WITCH_FLOWER_QUEST_ACCEPT,"&lt;hpage&gt;If you have knowledge or power to grant, I will aid you. These Pollip Hearts you desire... they can be found about the wood?&lt;page&gt;P... Pollip Hearts. Found in the wood. Yes, bug.&lt;page&gt;Seek out the purple blooms. Inside... the hearts.&lt;page&gt;The time of birth approaches. Pollip Hearts are needed. Bring them, bug, and power will be shared.",&lt;hpage&gt;若你能分享只是，我愿意帮忙。哪里能找到花芯？&lt;page&gt;花……花芯。树林间，对。&lt;page&gt;寻找紫花。芯……在其中。&lt;page&gt;诞生之时将至。带来花芯，共享力量。
WOOD_WITCH_FLOWER_QUEST_COMPLETE_3,Bug. Cloaked by red. The time of rebirth approaches.&lt;page&gt;First rite is completed. Prepared. For the time of birth.&lt;page&gt;Take.... take. The refuse of the rite.,红袍虫。重生之时将至。&lt;page&gt;初仪完成。准备。迎接诞生。&lt;page&gt;收下……仪式残渣。
WOOD_WITCH_FLOWER_QUEST_KEEPITEMS,Rrrr... rite. The first rite must begin. Pollip Hearts are needed.,呃……仪式。初仪必启。需要花芯。
WOOD_WITCH_CURSE_DECLINED,"&lt;hpage&gt;I am unable to help you. Not now. Perhaps another traveller will offer aid.&lt;page&gt;None... none come now. Once times, many bugs. Many. Now none. The final rite... the time of birth approaches...",&lt;hpage&gt;我现在无法帮助你，或许会有其他旅者伸出援手。&lt;page&gt;无虫……曾有许多……如今无虫。终仪……诞生之时将至……
WOOD_WITCH_MANDRAKE_ASK,Bug. Red cloak. Far-travelled. Bring it here... the bud.&lt;page&gt;It calls. It cries for the rite. Offer it.,虫。红袍虫。远旅者。你带来了……花苞。&lt;page&gt;它在呼唤。呼唤仪式。献上吧。
SETH_GUARDIAN_DECLINE,"Then go no further, that peace may remain between us.",那请就此止步，不必打破这份和平。
WOOD_WITCH_MANDRAKE_ACCEPT,The bud... weak. New. It must be nourished.&lt;page&gt;Nnn... nourished. It will be nourished.,花苞……孱弱。新生。需要滋养。&lt;page&gt;滋……滋养。得到滋养。
WOOD_WITCH_FLOWER_QUEST_ACCEPTED,"Seek out the purple blooms. Inside... the precious hearts.&lt;page&gt;The time of birth approaches. Pollip Hearts are needed. Bring them, bug, and power will be shared.",寻找紫花。内有……珍贵花芯。&lt;page&gt;诞生之时将至。带来花芯，共享力量。
WOOD_WITCH_FLOWER_QUEST_REOFFER,"Bug. Only you are left. None more tread here. None.&lt;page&gt;For the rite. The Pollip Hearts. They are needed. Bring them here, for the rite.",只剩你。无虫来此。&lt;page&gt; 仪式需要花芯。带来此处。
SETH_GUARDIAN_OFFER,Challenge the guardian?,挑战守卫者？
WOOD_WITCH_FLOWER_QUEST_COMPLETE_2,The first rite. Rite of the pollip. The first rite can begin.,初始仪式。花芯仪式。初仪可启。
WOOD_WITCH_FLOWER_QUEST_CANCOMPLETE,"The precious hearts... Give them. For the time of birth, for the rite, they must bleed...",珍贵花芯……交付。为了诞生，为了仪式，它们必须流血……
WOOD_WITCH_FLOWER_QUEST_OFFER,"The.... the time of birth approaches. Now, the rite of the pollip.&lt;page&gt;Bug. Only you are left. None more tread here. None.&lt;page&gt;For the rite. The Pollip Hearts. They are needed. Bring them here, for the rite.",……诞生之时将至。现在，花芯仪式。&lt;page&gt;虫。只剩你。无虫来此。&lt;page&gt;仪式需要花芯。带来此处。
WOOD_WITCH_MEET,"Shhhh... shell. White mask, red cloak.&lt;page&gt;Bug. A living bug.&lt;hpage&gt;A bug I am, at least in part, but you are something quite different. I apologise if I have roused you from some deep slumber.&lt;page&gt;Slumber. Long sleep. But now is the waking.&lt;page&gt;Growth. Time of birth. The time of birth approaches.&lt;page&gt;Heed, bug. The time of birth approaches.",嘘……甲壳。白面甲，红袍子。&lt;page&gt;虫。是活虫。&lt;hpage&gt;我算是半虫，但你倒是截然不同。若吵醒你的长眠，我道歉。&lt;page&gt;长眠。苏醒时分已至。&lt;page&gt;生长。诞生之时。诞生之时将至。&lt;page&gt;听着，诞生之时将至。
WOOD_WITCH_MANDRAKE_DECLINE,Th... the bud. It must be offered. It calls for it... for the rite.,花苞……必须献上。它在呼唤……呼唤仪式。
WOOD_WITCH_REPEAT,The time will come... Soon. The time of birth approaches.,时刻将至……诞生之时将至。
SETH_GUARDIAN_MEET,"Halt, stranger. I am charged forever to guard the sacred shrine beyond.&lt;page&gt;Any who wish to pass must cross their weapon with my own.",止步，陌生的虫。我奉命永远守护后方圣所。&lt;page&gt;想要过去，先问过我的兵器。
SETH_GUARDIAN_TALK1,"You may remain here and rest, if you choose. I am no enemy of yours. Only if you try to step beyond will I raise my weapon against you.&lt;hpage&gt;Then tell me, warrior, of the shrine you guard. These caves on wood&#8217;s edge seem long forgotten.&lt;page&gt;Some things may be hidden, but never forgotten. The shrine remains to remember the wood&#8217;s first seed, her that once was and always is.&lt;page&gt;I am the last bound to protect it. Sadly, in that service, many have fallen to my blade.",你可以在此处休息，只要不越界，我就不是你的敌人。&lt;hpage&gt;那就说说这处圣所吧。这深林边缘的洞窟似乎早已被遗忘。&lt;page&gt;事物或许会被被隐藏，但不会被遗忘。最初之种记得这处圣所，而她永恒存在。&lt;page&gt;我是最后一位守卫者。很遗憾，至今已有无数试图越界的亡魂。
